,id,date,text,likes,retweet,comments,urls
0,1347484440486940672,2021-01-08 10:05:00+00:00,Pssstt… Free special edition Coca Cola Cup.Bulan ini sahaja. https://t.co/JIlrzRitJF,76,19,6,[]
1,1290524629442813954,2020-08-04 05:47:03+00:00,Jom bermain skateboard dengan Grizz atau menaiki log sampan dengan Ice Bear dari We Bare Bears!  Percuma je dengan… https://t.co/SoRDH66hTn,32,15,2,[{'url': 'https://t.co/SoRDH66hTn'}]
2,1138339524738600961,2019-06-11 06:57:46+00:00,"Ya, kami baca notification!Anda mahukan Chocolate Pie?Kami bawakan Chocolate Pie! https://t.co/JsjSlKWsXf",1918,747,9,[]
3,1344135446813499395,2020-12-30 04:17:18+00:00,RT @Naz_haz99: Hobi saya adalah bekerja 💜#02OJRN500 #JOURNAKA #Hobi #Mekdi @McDMalaysia https://t.co/jnlbZh2LJ6,0,7,1,[]
4,1352979397804867594,2021-01-23 14:00:00+00:00,3am thought:Jual set untuk orang putus cinta         ‘McDerita’,17241,8142,11,[]
5,1376197611569344512,2021-03-28 15:40:53+00:00,Bila dua minuman kegemaran kita bersatu: McCafe + MILO = BAM! Ahh...Sedapnya bila dapat Ice Blended Milo Latte dan… https://t.co/ryAXhqnq4T,105,23,2,[{'url': 'https://t.co/ryAXhqnq4T'}]
6,1192442395243118593,2019-11-07 14:03:16+00:00,RT @CikTeh5: Yeayy to McValue Lunch and DinnerAvailable via McD apps. https://t.co/9yfK6pqKrP,0,351,1,[]
7,1318808877752741889,2020-10-21 06:58:33+00:00,Tahniah!! Anda pemenang baucar McDonald’s bernilai RM50! Sila DM kami maklumat anda untuk dihubungi selanjutnya. https://t.co/v4dJ8EynsM,57,6,4,[{'url': 'https://t.co/v4dJ8EynsM'}]
8,1363700039034359810,2021-02-22 04:00:00+00:00,Jom cuba tawaran masa terhad Burger Ayam Pedas dan Epal baharu sebelum terlambat! 😉 Pesan sekarang melalui McDelive… https://t.co/TxuGWxXi6x,14,3,0,[{'url': 'https://t.co/TxuGWxXi6x'}]
9,1294099895675047936,2020-08-14 02:33:52+00:00,Puaskan selera anda dengan Nasi Lemak McD bersama Ayam Goreng McD kegemaran ramai! Pesan sekarang melalui McDeliver… https://t.co/8Ze84ONI70,43,13,3,[{'url': 'https://t.co/8Ze84ONI70'}]
10,1384091908822106116,2021-04-19 10:30:00+00:00,"Pakej Parties@Home BAHARU dengan hidangan ayam McD kegemaran semua, sesuai dikongsi bersama! Dapatkan Big Mac Lun… https://t.co/fjcwQOwej4",10,1,0,[{'url': 'https://t.co/fjcwQOwej4'}]
11,1187018733732024323,2019-10-23 14:51:34+00:00,Might drive around and      | 👀 |      \   /____| |_____/          ✊__/\_✊stop by at McD Drive-Thru,2021,955,9,[]
12,1216953196112793601,2020-01-14 05:20:26+00:00,Burger yang tersakiti... https://t.co/NZ8DYvszna,1646,751,10,[]
13,1261484198763696128,2020-05-16 02:30:44+00:00,"Cikgu, hadirmu bagaikan mentari yang menerangi hidup kami dengan cahaya ilmu. Setulus ikhlas ingatan dari kami yang… https://t.co/BB2qVWbWan",70,22,1,[{'url': 'https://t.co/BB2qVWbWan'}]
14,1300757273023672320,2020-09-01 11:27:55+00:00,Reply tweet ini dengan ‘pickup line’ diselit produk Mekdi.Pastikan tak cringe.,429,99,10,[]
15,1298463563388866561,2020-08-26 03:33:32+00:00,Jeng jeng jeng. Keputusan sudah pun berada di tangan kami. Mesti korang tertanya-tanya McD mana yang berjaya kan. N… https://t.co/CI8n8LS8QN,95,40,4,[{'url': 'https://t.co/CI8n8LS8QN'}]
16,1177514313252106240,2019-09-27 09:24:24+00:00,These boots were made for dropping~And that’s just what they’ll doToday is the day that I will~Drop by kat Mekdi Drive-Thru 😎ewahhh,251,32,10,[]
17,1385032033290702848,2021-04-22 00:45:44+00:00,Siapa sini yang nampak kat mata McD Beef Foldover. Tapi dalam hati sebut Mekdi Beef Foldover?,76,8,8,[]
18,1115541097550241792,2019-04-09 09:04:58+00:00,Tragik https://t.co/cFyIMgprI0,414,206,9,[{'url': 'https://t.co/cFyIMgprI0'}]
19,1119812044285300736,2019-04-21 03:56:11+00:00,Cuba teka siapa akan buat comeback?Chicken Foldover ke Malique?,382,154,10,[]
20,1323902665894449154,2020-11-04 08:19:27+00:00,"Untuk menyeriakan timeline anda hari ini, kami di McDonalds mempersembahkan kehidupan students bernama meow bersam… https://t.co/rj4PQDhB72",1246,419,10,[{'url': 'https://t.co/rj4PQDhB72'}]
21,1318939608072159233,2020-10-21 15:38:01+00:00,Tahniah!! Anda pemenang baucar McDonald’s bernilai RM50! Sila DM kami maklumat anda untuk dihubungi selanjutnya. https://t.co/miI7iXvZSu,65,4,4,[{'url': 'https://t.co/miI7iXvZSu'}]
22,1380354783089938436,2021-04-09 03:00:00+00:00,"Setiap masa, adalah masa yang sesuai untuk Spicy Double Beef with Cheese. Puaskan selera anda sekarang dan pesan me… https://t.co/TyVr9WNkM8",13,2,3,[{'url': 'https://t.co/TyVr9WNkM8'}]
23,1311263353180835840,2020-09-30 11:15:20+00:00,"Dear valued guests, Please refer to the statement from McDonald’s Malaysia in response to an incident at McDonald… https://t.co/9JrDktE2w8",28,13,4,[{'url': 'https://t.co/9JrDktE2w8'}]
24,1162951598198288385,2019-08-18 04:57:22+00:00,"Retweet jika anda jenis makan French Fries last sekali selepas makan hidangan utama,Like jika anda jenis makan Fr… https://t.co/Rh2F7b1oDF",11558,1900,10,[{'url': 'https://t.co/Rh2F7b1oDF'}]
25,1341271202564739072,2020-12-22 06:35:48+00:00,Jawapan mantul yang pantas dari anda! Ternyata RM100 minggu ini milik anda. Korang yang belum menang tu kena lebih… https://t.co/0Y2um1dJol,32,3,0,[{'url': 'https://t.co/0Y2um1dJol'}]
26,1337577916872450048,2020-12-12 02:00:01+00:00,"Ada orang suka ayam, ada orang suka daging lembu. Tapi apa yang penting, dua-dua pun memang onz lah bila disatukan… https://t.co/s6VUYmnIbm",48,11,7,[{'url': 'https://t.co/s6VUYmnIbm'}]
27,1318889084195020802,2020-10-21 12:17:16+00:00,Tahniah!! Anda pemenang baucar McDonald’s bernilai RM50! Sila DM kami maklumat anda untuk dihubungi selanjutnya. https://t.co/4KPz6LvxnD,15,0,1,[{'url': 'https://t.co/4KPz6LvxnD'}]
28,1284697012965765120,2020-07-19 03:50:11+00:00,"Kami tahu korang kreatif lagi bergaya, so jom tunjukkan transformasi terbaik korang dengan sertai cabaran #McDaebak… https://t.co/kog5nthPmO",41,8,1,[{'url': 'https://t.co/kog5nthPmO'}]
29,1337215526515265536,2020-12-11 02:00:00+00:00,"Sos lada hitam burger Prosperity ni memang berhantulah! Tiap-tiap tahun mesti kena rasa. Kalau tak rasa, macam tak… https://t.co/iGuB1MPvG4",67,14,5,[{'url': 'https://t.co/iGuB1MPvG4'}]
30,1181469140281786368,2019-10-08 07:19:28+00:00,Kami tak ingat pula keluarkan produk ni.Cawangan mana ni? Ramai nak https://t.co/gU9QnngjJE,24005,26610,10,[{'url': 'https://t.co/gU9QnngjJE'}]
31,1369622815687680002,2021-03-10 12:15:00+00:00,"""Terus ku lupa kisah gusar semalam dengan kehadiran Sundae McD. Menjadi rebutan, tiada tandingan.""Jangan lupa sak… https://t.co/xoAZ7ZjKiQ",26,9,3,[{'url': 'https://t.co/xoAZ7ZjKiQ'}]
32,1360800938827472897,2021-02-14 04:00:00+00:00,Manis atau pedas? Apa kata anda cuba sendiri Burger Ayam Pedas dan Epal BAHARU kami! Pesan sekarang melalui McDeliv… https://t.co/Fd0BUBkzxs,17,4,2,[{'url': 'https://t.co/Fd0BUBkzxs'}]
33,1118806510589530112,2019-04-18 09:20:33+00:00,Unpopular opinion: Lambat reply text https://t.co/77LKpqKrQz,184,57,9,[]
34,1382265315568984069,2021-04-14 09:31:47+00:00,"Penuhi selera bila-bila, waktu operasi restoran kami kini dilanjutkan! Makan di restoran/Pandu Lalu/Bawa Balik dari… https://t.co/AdyL2U1oQc",191,128,9,[{'url': 'https://t.co/AdyL2U1oQc'}]
35,1106452297632997377,2019-03-15 07:09:19+00:00,"Kami tak mainlah sos hantu-hantu ni. Tahyul...Ni haa, rasa pedas yang sebenar! Dapatkan set sederhana Spicy Chick… https://t.co/I9W39qgiPB",495,356,9,[{'url': 'https://t.co/I9W39qgiPB'}]
36,1128269181139296256,2019-05-14 12:01:49+00:00,Kopi-kopi di McCafe kami sedia berkhidmat untuk mengembalikan tenaga anda selepas tarawikh malam ini. https://t.co/HQrd36kI99,168,34,7,[]
37,1125257326733041664,2019-05-06 04:33:47+00:00,"Bulan Ramadan yang suci, penuh barakah dan rahmat telah pun tiba. Selamat menunaikan ibadah puasa buat semua umat I… https://t.co/9aVtDU6w1K",104,9,4,[{'url': 'https://t.co/9aVtDU6w1K'}]
38,1318888792166600704,2020-10-21 12:16:06+00:00,Tahniah!! Anda pemenang baucar McDonald’s bernilai RM50! Sila DM kami maklumat anda untuk dihubungi selanjutnya. https://t.co/zORLtUmW4H,72,3,7,[{'url': 'https://t.co/zORLtUmW4H'}]
39,1377147132793081856,2021-03-31 06:33:57+00:00,"Kalau nak makan lebih dari dua orang..Order je Family Meal, boleh jimat sehingga RM21.09!",64,7,1,[]
40,1366318542761639940,2021-03-01 09:25:00+00:00,"Kalau kita campurkan fries kita sekali, ‘true friendship’ lah kan?",143,23,8,[]
41,1386266233113169933,2021-04-25 10:30:00+00:00,Kan sedap kalau hidangan berbuka ditemani Pai Kastard Mangga. Tambah order semasa anda Pandu Lalu. Senang. https://t.co/cDWEKsEEM3,21,0,1,[]
42,1311630210786189312,2020-10-01 11:33:05+00:00,RT @halemyroslee: Yeay! My 1st Golden Minions from @McDMalaysia Happy Meals! https://t.co/MB2ZzsPOoU,0,14,1,[]
43,1376972327330537474,2021-03-30 18:59:20+00:00,Tanda kami ambil berat tentang anda:“Nak tukar ke set large tak?”,384,67,10,[]
44,1359098599578083329,2021-02-09 11:15:31+00:00,Time-time macam ni mesti teringin sesuatu yang manis. Apa kata kita cuba Pai Kastard Oren Baharu dan McFlurry Bisku… https://t.co/vRGrYNw0wQ,32,7,6,[{'url': 'https://t.co/vRGrYNw0wQ'}]
45,1357169522029981698,2021-02-04 03:30:03+00:00,Keenakan rasa kepingan epal manis dan ayam pedas. Manis atau pedas? Cuba dulu. Pesan Burger Ayam Pedas dan Epal BAH… https://t.co/iOdBsol1Yv,108,41,11,[{'url': 'https://t.co/iOdBsol1Yv'}]
46,1332188976187203584,2020-11-27 05:06:17+00:00,"Kalau korang nak tau, Mohamad Shahril merupakan diantara rider yang prestasinya amat cemerlang walaupun baru sahaja… https://t.co/FXN5VhkaE7",33,1,4,[{'url': 'https://t.co/FXN5VhkaE7'}]
47,1318938278641364993,2020-10-21 15:32:44+00:00,Tahniah!! Anda pemenang baucar McDonald’s bernilai RM50! Sila DM kami maklumat anda untuk dihubungi selanjutnya. https://t.co/kvHwaiks6B,36,2,1,[{'url': 'https://t.co/kvHwaiks6B'}]
48,1330735014250647558,2020-11-23 04:48:45+00:00,RT @McDMalaysia: Bila kau nak diet tapi dah TER-singgah Drive-Thru McD:haha        haha                 aha haha        haha…,0,8951,1,[]
49,1352278445762379779,2021-01-21 15:34:40+00:00,"Walaupun PKP, penuhi selera anda melalui servis Pandu Lalu atau bawa balik dari 8pg - 10mlm. Paling senang, McDeliv… https://t.co/WutM6iEbvm",114,39,10,[{'url': 'https://t.co/WutM6iEbvm'}]
50,1107451305168011264,2019-03-18 01:19:01+00:00,Tak payah tunggu hari Selasa. Everyday is a chicken day at McDonald's! https://t.co/45xDoNAtUb,280,174,9,[]
51,1246675623763820544,2020-04-05 05:46:45+00:00,"Bila kelaparan di rumah, apa kata anda cuba Burger Daging BBQ baharu kami! Hanya pesan melalui McDelivery tanpa sen… https://t.co/Y8oEXOMfol",252,85,8,[{'url': 'https://t.co/Y8oEXOMfol'}]
52,1102509385589284867,2019-03-04 10:01:35+00:00,https://t.co/Te4qGPy3U7,486,464,6,[]
53,1321291081955368961,2020-10-28 03:21:56+00:00,Korang ada dengar tak cerita pasal Ayam Goreng Paling Viral tu? Cuba try search... #AyamGorengViral https://t.co/QRGvj5gNSv,51,6,3,[]
54,1362375731532034052,2021-02-18 12:17:40+00:00,"Apple muda, memang buas sikit.Terima kasih Hazley! Kami akan take note. https://t.co/8SwsiJIwcl",60,6,3,[{'url': 'https://t.co/8SwsiJIwcl'}]
55,1370725079043084294,2021-03-13 13:15:00+00:00,"""Nasihat kami, set Family Meal McD lebih seronok bila makan berkongsi. Senang je, pesan melalui McDelivery.""Saksi… https://t.co/5cLhwpd17h",75,16,11,[{'url': 'https://t.co/5cLhwpd17h'}]
56,1369483148812120066,2021-03-10 03:00:01+00:00,"Memperkenalkan, Spicy Beef Burgers! Lebih pedas, lebih menyengat. Pesan sekarang melalui McDelivery atau Pandu-Lalu. https://t.co/Yg3BK6HW8J",21,5,0,[]
57,1278526560484507649,2020-07-02 03:11:00+00:00,"Nantikan kemunculan semula Rilakkuma, Thomas &amp; Friends, Monster Jam dan Cutie Cars! Dapatkan mainan kegemaran anda… https://t.co/GShTzwt3T4",38,11,4,[{'url': 'https://t.co/GShTzwt3T4'}]
58,1339065665932513280,2020-12-16 04:31:48+00:00,"#McCafeTwitterTeki telah memasuki minggu ketiga! Baucar McDonald's RM100 untuk anda menangi hanya dengan teka, jawa… https://t.co/bdWYkYnfFC",73,15,10,[{'url': 'https://t.co/bdWYkYnfFC'}]
59,1318805531167846402,2020-10-21 06:45:15+00:00,Tahniah!! Anda pemenang baucar McDonald’s bernilai RM50! Sila DM kami maklumat anda untuk dihubungi selanjutnya. https://t.co/hr6tVjzCJG,25,2,4,[{'url': 'https://t.co/hr6tVjzCJG'}]
60,1356935468525445122,2021-02-03 12:00:00+00:00,🍔 + 🍎 + 🌶️Apa agaknya burger bulan ini?,187,23,11,[]
61,1338431036213092353,2020-12-14 10:30:00+00:00,The NEW Chocolate Brownie McFlurry is happiness in a cup! Dig into delicious chocolate swirls and sweet chunks of b… https://t.co/mQz6bYFy4A,76,22,2,[{'url': 'https://t.co/mQz6bYFy4A'}]
62,1108936246816989185,2019-03-22 03:39:38+00:00,"Cara pembayaran di kaunter McD1. Tunai2. Debit Card/PayWave3. QR Code4. “Weh pakai duit ko dulu, nanti aku bayar balik”.",20323,28247,9,[]
63,1344154572126752770,2020-12-30 05:33:17+00:00,"RT @fidonasir: Thank you soooo much @McDMalaysia sebab tunaikan mak mengandung punya mengidam, walaupun belum 10am lagi.Special thanks to…",0,41,1,[]
64,1311627343094444033,2020-10-01 11:21:42+00:00,Kami tiada jawapan bagi yang bertanya adakah membeli Happy Meal akan menghilangkan kesedihan kisah cinta yang silam… https://t.co/LLVFuwzgct,1131,480,11,[{'url': 'https://t.co/LLVFuwzgct'}]
65,1374952502957760512,2021-03-25 05:13:16+00:00,"Pengembaraan dasar laut berakhir minggu inidengan ""Plankton's Chum Bucket"" dan ""Mermaidman &amp; Shady Shoals”!Cepat… https://t.co/pAUEGAdFkv",13,1,0,[{'url': 'https://t.co/pAUEGAdFkv'}]
66,1215603899219857408,2020-01-10 11:58:49+00:00,Buat masa ni kita tak open sell for property. https://t.co/6f41gGHsSG,17385,19909,9,[{'url': 'https://t.co/6f41gGHsSG'}]
67,1275311988491423746,2020-06-23 06:17:26+00:00,Hobi Sebelum PKP:                            Hobi Semasa PKP: https://t.co/hvbjT8d3Pe,730,357,4,[]
68,1358704555974750211,2021-02-08 09:09:44+00:00,"Hidangan enak &amp; tawaran hebat, kami hantarkan terus ke rumah anda. Dapatkan diskaun 40% Crazy Hour orders dari 3pm-… https://t.co/26zRny0Pa3",27,3,1,[{'url': 'https://t.co/26zRny0Pa3'}]
69,1384517574700929028,2021-04-20 14:41:27+00:00,Tahniah kepada 25 pemenang pertama! Rujuk gambar ini atau klik https://t.co/N75uui2MIy &amp; ketahui senarai pemenang.… https://t.co/QJH2703uTg,51,6,4,"[{'url': 'https://t.co/N75uui2MIy'}, {'url': 'https://t.co/QJH2703uTg'}]"
70,1273508293176995841,2020-06-18 06:50:12+00:00,Milo anda dah rasa.Oreo anda dah rasa.Mangga dah rasa? https://t.co/8naipjbrEc,1067,397,10,[]
71,1314001466332389376,2020-10-08 00:35:37+00:00,Bangun bangun! Masa untuk sarapan! Nikmati sarapan Sandwic Sambal Ayam Rangup &amp; Telur Scrambled baharu. Betul ada s… https://t.co/4k6gTWdtNE,61,15,3,[{'url': 'https://t.co/4k6gTWdtNE'}]
72,1362381137172070402,2021-02-18 12:39:09+00:00,"Kononnya macam balance la.Exercise di kala pagi, cheat day di sore hari.😆 https://t.co/ugQ1QbIWQm https://t.co/qwexuOqHA7",40,12,4,[{'url': 'https://t.co/ugQ1QbIWQm'}]
73,1199322036201385984,2019-11-26 13:40:30+00:00,Kita semua ada kawan yang macam ni. Tolong tag kawan korang tu.#akademimekdi https://t.co/mwEaNYsjut,419,141,6,[]
74,1271070043145596928,2020-06-11 13:21:28+00:00,Nak ke? https://t.co/f5KyjAtPGJ,55858,29582,11,[{'url': 'https://t.co/f5KyjAtPGJ'}]
75,1320586620114878469,2020-10-26 04:42:40+00:00,Bukan border tengah closed ke? https://t.co/EuAe7e8BCA,569,100,11,[{'url': 'https://t.co/EuAe7e8BCA'}]
76,1336898439796416514,2020-12-10 05:00:01+00:00,"Kalau anda kerja dengan kami,Kami bayar guna wang ringgit ya, tak boleh la bayar dengan McFlurry.Pelbagai peluan… https://t.co/ddtL00YRXV",69,8,1,[{'url': 'https://t.co/ddtL00YRXV'}]
77,1334800287588962304,2020-12-04 10:02:42+00:00,"Di Malaysia kita gelar drive-thru, tapi negara lain di luar Amerika ada yang  gelar “McAuto”, “McDrive” dan “AutoMac”",22,0,7,[]
78,1282742261256609792,2020-07-13 18:22:41+00:00,https://t.co/Z7ykWAsLvF https://t.co/kJF3c9kmQI,163,33,2,[{'url': 'https://t.co/Z7ykWAsLvF'}]
79,1316596032474546176,2020-10-15 04:25:29+00:00,Aduh lapar la pulak sambil reply-reply ni. https://t.co/Ab1e1WFYOi,399,77,11,[{'url': 'https://t.co/Ab1e1WFYOi'}]
80,1284048334362009601,2020-07-17 08:52:34+00:00,Nak bagitau sikit. Janji tak banyak. Jom cuba Pai Black Forest baharu dengan kelazatan strawberi dan krim kustard d… https://t.co/N0KKuN90Xg,408,77,10,[{'url': 'https://t.co/N0KKuN90Xg'}]
81,1321331422502645762,2020-10-28 06:02:14+00:00,Tahukah anda McDonald’s mempunyai universiti sendiri bernama Hamburger University.Ditubuhkan pada tahun 1961 dan… https://t.co/Eabpo2Qz7k,305,59,5,[{'url': 'https://t.co/Eabpo2Qz7k'}]
82,1298060262369501184,2020-08-25 00:50:57+00:00,ترچيدوك https://t.co/IwHN4xFtjK,11279,6086,12,[{'url': 'https://t.co/IwHN4xFtjK'}]
83,1336973933640290305,2020-12-10 10:00:00+00:00,🍔 = 30🍟 = 50🍦 = 3Hitung jumlah di bawah :🍔🍔🍔 ✖️ 🍟🍟 ➗ 🍦,413,17,10,[]
84,1101034168698335232,2019-02-28 08:19:36+00:00,"LIKE untuk selipar Balenciaga, RETWEET untuk selipar McD Fries. https://t.co/sWWD97Oitt",298,418,1,[]
85,1243050630328942593,2020-03-26 05:42:19+00:00,Sungguh besar jasa para petugas kesihatan yang tak berputus asa berusaha memberi khidmat kesihatan kepada kita semu… https://t.co/NLBOyW4JkP,106,17,5,[{'url': 'https://t.co/NLBOyW4JkP'}]
86,1381458780152504324,2021-04-12 04:06:54+00:00,Tanda kita harmoni… bila Anthony kat sebelah krup… krap… makan ayam goreng McD. Lepas tu Sorry! Lupalah U puasa! Kita senyum aje...,85,9,6,[]
87,1158356138946990082,2019-08-05 12:36:39+00:00,(Bapa semua orang)Bapa anda tertidur ketika menonton TV lalu anda mengambil remote untuk menutup TV.Bapa anda t… https://t.co/TlLiXYp1SS,891,465,9,[{'url': 'https://t.co/TlLiXYp1SS'}]
88,1308341096703881217,2020-09-22 09:43:19+00:00,Show off your HANGAT OOTD in #StyleHangatMcD Challenge. Join in 3 simple steps: 1: Order a Spicy Chicken McDeluxe/S… https://t.co/c3GmZgCU3w,18,6,1,[{'url': 'https://t.co/c3GmZgCU3w'}]
89,1138775426195525632,2019-06-12 11:49:53+00:00,"McD : Hi Cik, nak pesan apa?Pelanggan : Saya nak pesan ni, buat baik berpada-pada, buat jahat jangan sekali.McD: ….Pelanggan: 😀",1997,987,9,[]
90,1306019983844048896,2020-09-16 00:00:03+00:00,"Selamat Hari Malaysia! Satu hati, satu jiwa, hidup harmoni sentiasa. Ayuh kita kekalkan semangat perpaduan, demi ke… https://t.co/581vofDDmA",56,15,1,[{'url': 'https://t.co/581vofDDmA'}]
91,1323937890380902401,2020-11-04 10:39:25+00:00,"Masa kanak-kanak ketenangan adalah dapat keluar bermain dekat luar rumah,Bila dewasa ketenangan adalah dapat reha… https://t.co/l3ieod5x5j",105,8,8,[{'url': 'https://t.co/l3ieod5x5j'}]
92,1333259684543827968,2020-11-30 04:00:54+00:00,Apa perasaannya makan ayam goreng Mekdi dengan roti?Dah rasa Grand McChicken &amp; Spicy Grand McChicken?Aih lapar… https://t.co/l1HnzP8goP,81,10,8,[{'url': 'https://t.co/l1HnzP8goP'}]
93,1146478665024151555,2019-07-03 17:59:48+00:00,"Hai, adakah anda sedang sendu pada pukul 2 pagi?Lebih sedap sendu sambil makan di McD. Servis kami 24 jam.",748,329,10,[]
94,1183004916836524032,2019-10-12 13:02:05+00:00,"Kalau belakang tak ada kereta, tak apa Aiman. https://t.co/Daf2eCAHSu",7308,6910,9,[{'url': 'https://t.co/Daf2eCAHSu'}]
95,1318398690730496001,2020-10-20 03:48:37+00:00,Tahniah!! Anda pemenang baucar McDonald’s bernilai RM50! Sila DM kami maklumat anda untuk dihubungi selanjutnya. https://t.co/ixWdy1oC54,35,4,4,[{'url': 'https://t.co/ixWdy1oC54'}]
96,1356935474485493763,2021-02-03 12:00:02+00:00,Kombo terhangat! Akan datang esok. https://t.co/QVfbzTcmKH,82,13,4,[]
97,1370362690917392387,2021-03-12 13:15:00+00:00,"""Hari panas, hati pun panas! Nasib baik ada McFlurry, rahsia penyejuk hati. Pesan melalui McDelivery hari ini, jang… https://t.co/qVTzXdjbW3",47,10,3,[{'url': 'https://t.co/qVTzXdjbW3'}]
98,1123787828192788480,2019-05-02 03:14:31+00:00,Its ma time to shine sis @DahliaRizal,441,138,4,[]
99,1252200058709131264,2020-04-20 11:38:53+00:00,Kerana Ramadhan tiberRamadhan tiber https://t.co/X6hTMu7jz3,666,349,11,[{'url': 'https://t.co/X6hTMu7jz3'}]
100,1316620094768783360,2020-10-15 06:01:06+00:00,Tawaran menarik untuk pengguna Maybank QRPay! Nikmati pulangan tunai segera RM5 dengan pembelian sebanyak RM25 &amp; ke… https://t.co/D5x4V3MY3m,28,10,0,[{'url': 'https://t.co/D5x4V3MY3m'}]
101,1130811683541143552,2019-05-21 12:24:49+00:00,"Apa kata bulan ini, kita belanja beli juadah berbuka untuk kawan-kawan sekeliling. Kat McD kami bersedia untuk meno… https://t.co/xQQaUl7ISs",324,51,9,[{'url': 'https://t.co/xQQaUl7ISs'}]
102,1314768009060261890,2020-10-10 03:21:35+00:00,Bukan madu yang itu. Tapi ini madu Burger Daging Honey Mustard BAHARU dari McD. Isteri anda pun mesti suka. Kepuasa… https://t.co/9Y8MAp76Tz,61,11,8,[{'url': 'https://t.co/9Y8MAp76Tz'}]
103,1150661688368095232,2019-07-15 07:01:39+00:00,"Aduh, ingatkan menggeletar rusuk kiri tadi https://t.co/ucEw4iPj8V",354,93,8,[{'url': 'https://t.co/ucEw4iPj8V'}]
104,1317683346516836352,2020-10-18 04:26:05+00:00,"Tengah nak makan burger daging Mekdi ke tu? Tunggu jap, ambil gambar kreatif dulu! Dan share kat thread… https://t.co/DHgE8aAEWJ",25,5,2,[{'url': 'https://t.co/DHgE8aAEWJ'}]
105,1296011255069569024,2020-08-19 09:08:56+00:00,"Nasi Lemak McD Rendang Ayam ni memang sedap, tapi…lagi sedap kalau orang kat atas ni yang belanja. https://t.co/EwzSPaRgDg",126,27,10,[]
106,1385402020530515970,2021-04-23 01:15:55+00:00,Agak-agaknya bila hari Jumaat ni. Apa yang korang rasa,14,3,6,[]
107,1282982068188667904,2020-07-14 10:15:36+00:00,"Oppa, Noona yang ku dambai. Burger Korea Hangat Daebak is back! Dua pilihan antara Daging dan Ayam. Rasai kehangata… https://t.co/pdMCDdcJhz",3818,1371,10,[{'url': 'https://t.co/pdMCDdcJhz'}]
108,1120611046039769088,2019-04-23 08:51:07+00:00,RT @neyrashazeyra: Pakai apps @McDMalaysia berbaloi skit . Dapat ayam seketul . https://t.co/HC1ztIB1xU,0,19,1,[]
109,1311630840737140736,2020-10-01 11:35:36+00:00,https://t.co/awRgPpmGec https://t.co/YXJsvmCJwZ,3247,2166,10,[{'url': 'https://t.co/awRgPpmGec'}]
110,1334319592831782914,2020-12-03 02:12:36+00:00,Tak sabarnya nak cuba #IcedBlendedMochaOREO dari McCafe! Tunggu apa lagi? Jom gerak sekarang! #McCafeOREOisback,122,40,11,[]
111,1378918589583880192,2021-04-05 03:53:05+00:00,Tanda puasa moden: Bila dah dengar sayup-sayup nama kurma tu kat radio.,172,45,9,[]
112,1355108433398124547,2021-01-29 11:00:01+00:00,"Jangan tunggu lama-lama, nanti lama-lama, RM18,888 dikebas orang. Gais, tinggal 2 hari je lagi. Tunggu apa lagi, jo… https://t.co/wlmtY9v52R",12,5,0,[{'url': 'https://t.co/wlmtY9v52R'}]
113,1214494338807255040,2020-01-07 10:29:49+00:00,Which one are you?Beyblade:- Garang- Suka berpusing- Biceps dan triceps kuatHello Kitty:- Miaw- Mau - Pur… https://t.co/cx2aYv5nQE,252,34,6,[{'url': 'https://t.co/cx2aYv5nQE'}]
114,1318890173548032000,2020-10-21 12:21:35+00:00,Tahniah!! Anda pemenang baucar McDonald’s bernilai RM50! Sila DM kami maklumat anda untuk dihubungi selanjutnya. https://t.co/u9X9WcuXCU,21,2,4,[{'url': 'https://t.co/u9X9WcuXCU'}]
115,1271121245669482496,2020-06-11 16:44:55+00:00,"Bila raya sebulan dah over,Tapi kau masih tak menerima duit raya https://t.co/nN4FV6ry7d",328,66,10,[]
116,1385586757324791810,2021-04-23 13:30:00+00:00,"Setiap selera anda sekeluarga, pastinya ada di McD. Buka puasa bersama yang tersayang kini lebih mudah, pesan melal… https://t.co/oTuSuFpfzj",14,2,1,[{'url': 'https://t.co/oTuSuFpfzj'}]
117,1255836742512340994,2020-04-30 12:29:46+00:00,"Tips untuk surprise gf/bf korang:Order McDelivery, pastikan ada McFlurry dan pie dan hantar ke alamat rumah dia. https://t.co/88DBsyiCk1",225,85,9,[]
118,1321652114515324928,2020-10-29 03:16:33+00:00,👀 Korang.. ada benda lah dalam poket tu. Oh ada Minions emas! Cepat screenshot semua Minions emas &amp; RT dengan jaw… https://t.co/yzzXUNGMft,129,40,10,[{'url': 'https://t.co/yzzXUNGMft'}]
119,1202171888811704320,2019-12-04 10:24:48+00:00,"Para saudara saudari,Tak yah la rindu-rindu lagi,Burger Pr_s_er_ty kini kembali! Isikan tempat kosong and win nothing.",1178,414,10,[]
120,1353963341429891073,2021-01-26 07:09:50+00:00,Yang komen-komen kat bawah ni.Y'all okay ke? https://t.co/CR8vSOaqbC,76,11,8,[{'url': 'https://t.co/CR8vSOaqbC'}]
121,1182242817852071936,2019-10-10 10:33:47+00:00,https://t.co/yuw7PlgyKv https://t.co/XVK0Db4vZs,137,53,1,[{'url': 'https://t.co/yuw7PlgyKv'}]
122,1318160461095825408,2020-10-19 12:01:58+00:00,Tahniah!! Anda pemenang baucar McDonald’s bernilai RM50! Sila DM kami maklumat anda untuk dihubungi selanjutnya. https://t.co/TuldxrjoqT,32,7,8,[{'url': 'https://t.co/TuldxrjoqT'}]
123,1283592438599184385,2020-07-16 02:41:00+00:00,Monster Jam dan Cutie Cars kini kembali di McDonald’s! Jangan ketinggalan dan kumpulkan koleksi mainan ini dengan s… https://t.co/QVmdo7AStJ,30,6,0,[{'url': 'https://t.co/QVmdo7AStJ'}]
124,1267255924428701696,2020-06-01 00:45:31+00:00,Gayu Guru Gerai Nyamai! Raikan dengan penuh keceriaan. Selamat Hari Gawai daripada kami di Mekdi. https://t.co/QQne2vLsOs,78,14,1,[]
125,1338747877514903553,2020-12-15 07:29:01+00:00,Sesiapa yang tahu tolong bagitahu pada yang taktahu yang mereka patut tahu jika mereka beli Mekdi dan bayar menggun… https://t.co/GBXM7v75W6,114,27,3,[{'url': 'https://t.co/GBXM7v75W6'}]
126,1153233311046615040,2019-07-22 09:20:22+00:00,Bila boleh makan semua McNuggets sorang-sorang tanpa housemates minta sikit https://t.co/67UpaH5NdC,305,79,10,[]
127,1194895195055116288,2019-11-14 08:29:49+00:00,"Pada yang tak sempat ke stadium tu. Jangan bersedih, kita boleh tonton di rumah.Sambil makan mana-mana burger dag… https://t.co/lVeCIUNjg0",375,85,10,[{'url': 'https://t.co/lVeCIUNjg0'}]
128,1360076160105738240,2021-02-12 04:00:00+00:00,Meriahkan lagi sambutan Tahun Baharu Cina dengan Burger Ayam Pedas dan Epal! Pesan sekarang melalui McDelivery atau… https://t.co/N786jXfmOe,21,6,1,[{'url': 'https://t.co/N786jXfmOe'}]
