,id,date,text,likes,retweet,comments,urls
129,1317073362695254016,2020-10-16 12:02:14+00:00,Tahniah!! Anda pemenang baucar McDonald’s bernilai RM50! Sila DM kami maklumat anda untuk dihubungi selanjutnya. https://t.co/fCbowzKqaf,170,14,5,[{'url': 'https://t.co/fCbowzKqaf'}]
130,1374718076013277185,2021-03-24 13:41:45+00:00,My ‘nak diet tapi lapar Mekdi’ in one graph. https://t.co/mUJPgIiM6d,345,96,7,[]
131,1328878672124596224,2020-11-18 01:52:19+00:00,Korang tahu tak kami ada Hotcakes yang lazat dihidang bersama sirap dan marjerin?Hanya untuk geng bangun pagi. https://t.co/nyBb6uiwv2,114,17,11,[]
132,1350669175048572929,2021-01-17 05:00:00+00:00,"Bila kawan beli set, kau beli ala carte.(\_/)( •_•)  “cikit”/ &gt;🍟",768,303,11,[]
133,1283340654186074112,2020-07-15 10:00:29+00:00,"Jika anda peminat K-Pop atau K-Drama, anda pasti suka Burger Korea Pedas yang Daebak ini! https://t.co/hrvxEgmIuW",578,177,10,[]
134,1188713589332275201,2019-10-28 07:06:19+00:00,3 karakter utama kita.  Boleh teka tak burger apa ni? https://t.co/c1NgFc1GMA,383,68,9,[]
135,1334800296510246914,2020-12-04 10:02:44+00:00,"Adanya McDonalds drive-thru, abang-abang askar ini boleh bergembira kenyang memakan burger mereka dan kembali bertugas.",31,0,7,[]
136,1318805231107334146,2020-10-21 06:44:03+00:00,Tahniah!! Anda pemenang baucar McDonald’s bernilai RM50! Sila DM kami maklumat anda untuk dihubungi selanjutnya. https://t.co/rEzkcIl3yR,16,1,2,[{'url': 'https://t.co/rEzkcIl3yR'}]
137,1353666425563590656,2021-01-25 11:30:00+00:00,"Siapa nak menang duit RM18,888? Senang je. Duet dalam Bahasa Cina dengan Baki macam @AlvinChong123 ni. Senang je, a… https://t.co/w0wXtxAblZ",8,0,0,[{'url': 'https://t.co/w0wXtxAblZ'}]
138,1299173475655905280,2020-08-28 02:34:28+00:00,"Sempena ulang tahun ke-50 Doraemon, ayuh terokai gadget canggih dan innovatif Doraemon dengan Happy Meal! Kumpulkan… https://t.co/4oE6XL9tpA",82,24,5,[{'url': 'https://t.co/4oE6XL9tpA'}]
139,1378509340928135173,2021-04-04 00:46:52+00:00,Betul. Hari ni dah Ahad. Esok Isnin. Muka tu jangan buat terperanjat pulak ye. https://t.co/N0RRet7dzJ,1085,441,10,[]
140,1312937186761744384,2020-10-05 02:06:33+00:00,"Tiga kombinasi mantap dari McD. Ada Smoky Grilled Beef, Quarter Pounder dengan Keju dan Burger Daging Honey Mustard… https://t.co/AQgqyqyear",116,45,9,[{'url': 'https://t.co/AQgqyqyear'}]
141,1331910878195638272,2020-11-26 10:41:13+00:00,Psst...kami tahu anda suka pedas.SPICY GRAND MCCHICKEN!(Bagi yang tak suka pedas juga ada) https://t.co/mDToexWuOS,99,16,1,[]
142,1324192211706081280,2020-11-05 03:30:00+00:00,"Bak kata orang, Ayam Goreng McD boleh jadi pengikat kasih tau. Cubalah kalau tak caya... https://t.co/2XnzgUGZeq",31,3,1,[]
143,1237910695351480321,2020-03-12 01:18:03+00:00,"Pesanan untuk adik-adik bersekolah.Buli kawan, is a No-No.Belanja kawan, is a Yes-Yes.Okay?",732,202,9,[]
144,1381962879105032192,2021-04-13 13:30:00+00:00,"Bulan Ramadan penuh dugaan, namun pasti ada kemanisan. Begitu juga dengan pengalaman berpuasa Syukur. Sampai Mama p… https://t.co/7PRG3L3Wms",856,205,10,[{'url': 'https://t.co/7PRG3L3Wms'}]
145,1152168339550027782,2019-07-19 10:48:33+00:00,"Roses are red, Sweet is Strawberry.Tak ada mood nak beli sendiri,Guna la #McDelivery",613,222,10,[]
146,1379992398953123843,2021-04-08 03:00:01+00:00,Cabar selera anda dengan Spicy Beef Burgers baharu hari ini! Pesan sekarang melalui McDelivery atau Pandu-Lalu. https://t.co/6skg90IvYX,9,4,0,[]
147,1362379982408876036,2021-02-18 12:34:34+00:00,RT @verybunny: Tahniah @McDMalaysia sebab include nutrition facts of each menu. Yang ini untuk ayam goreng. https://t.co/XU6f0krS7O,0,4,1,[]
148,1276918017805279232,2020-06-27 16:39:14+00:00,"Big, Mac,Big, Mac,dah nak masuk bulan Julai eh? Laju je tahun 2020 ni.",313,26,10,[]
149,1118091675300052992,2019-04-16 10:00:03+00:00,Ya Ampun... Life hack Kak Zati https://t.co/OOb0mmnZdm,351,157,4,[{'url': 'https://t.co/OOb0mmnZdm'}]
150,1325736268538417152,2020-11-09 09:45:32+00:00,UJIBAKAT NYANYIANJuri: Awak nak nyanyikan lagu apa?Me: Lagu buburJuri: Lagu bubur?Me: Bubur ayam… bubur aya… https://t.co/1eeDRx2jEY,268,32,10,[{'url': 'https://t.co/1eeDRx2jEY'}]
151,1371471714538819587,2021-03-15 14:41:52+00:00,Boss : Apa update terbaru dekat Twitter?Admin :Minggu ni komen-komen ‘Nak belajar mandarin class tak?’ dah berkurangan boss.,240,35,8,[]
152,1237595527337787398,2020-03-11 04:25:41+00:00,STOP ✋ Tahukah y'all McD meraikan guru-guru yang banyak berjasa?So kalau korang ada cikgu yang sempoi banyak be… https://t.co/7uYpJhr4kt,93,14,3,[{'url': 'https://t.co/7uYpJhr4kt'}]
153,1330118771969671168,2020-11-21 12:00:02+00:00,Debaran kian terasa... Saksikan kehangatan Grand McChicken di Muzik Muzik 35 Separuh Akhir #SFMM35 #AJL35 https://t.co/DGCa0oFCGq,37,4,3,[]
154,1153905644023365632,2019-07-24 05:51:58+00:00,"Kenapa bila kucing tidur kat office ni semua cakap comel, tapi bila aku tidur kat office boss marah suruh fikir next tweet.",10788,9278,9,[]
155,1373125366508711938,2021-03-20 04:12:53+00:00,Anda GENG SPICY BEEF yang mana?🔁 Geng Spicy Double Beef❤️ Geng Spicy Quarter Pounder Cheese,79,20,0,[]
156,1336236609478389760,2020-12-08 09:10:08+00:00,Tolong stop jerit “Yes nombor mengena!” bila nombor order ada tertera di skrin restoran kami.Cashier kami tak lar… https://t.co/hoUF0zkzNw,4597,906,10,[{'url': 'https://t.co/hoUF0zkzNw'}]
157,1356573084799520768,2021-02-02 12:00:01+00:00,Nantikan sesuatu yang hangat. Akan datang 4 Feb 2021.  🍎+🌶️ https://t.co/pyRdS1qCBB,76,24,9,[]
158,1361638958950535169,2021-02-16 11:30:00+00:00,Waktu cuaca panas sekarang adalah waktu terbaik untuk gambar ini melalui timeline anda. https://t.co/yB6gQ02ClW,197,41,10,[]
159,1266888783036739584,2020-05-31 00:26:38+00:00,Kotobian Tadau Tagazo Do Kaamatan daripada kami di Mekdi! Selamat menyambut bersama keluarga tercinta. https://t.co/OFnaUDZwKw,51,7,0,[]
160,1274557799561748480,2020-06-21 04:20:34+00:00,Terima kasih atas penat lelah anda demi mengukir senyuman keluarga tercinta. Selamat Hari Bapa semua! Andalah hero… https://t.co/WyXEvyxQkB,147,20,2,[{'url': 'https://t.co/WyXEvyxQkB'}]
161,1139103329609347072,2019-06-13 09:32:51+00:00,"Jika anda dapat membezakan haiwan seperti beruang, anda pasti bijak membezakan produk yang mana patut menjadi produ… https://t.co/4DfHAV3Xb2",284,51,10,[{'url': 'https://t.co/4DfHAV3Xb2'}]
162,1133329370108448768,2019-05-28 11:09:12+00:00,"Pada yang dah sampai di kampung tu, kalau rindu dengan kami.Janganlah segan-segan order menggunakan McDelivery. K… https://t.co/9NJqJZ53PN",424,75,10,[{'url': 'https://t.co/9NJqJZ53PN'}]
163,1131511816834564096,2019-05-23 10:46:54+00:00,Anda tahu rasa kesegaran air Ribena?Bagaimana pula dengan Ice Blended Ribena?Rasanya anda kena rasai sekarang di… https://t.co/RnROZ0IRvR,502,161,9,[{'url': 'https://t.co/RnROZ0IRvR'}]
164,1145577832396935168,2019-07-01 06:20:13+00:00,"Ex anda mungkin tidak akan kembali, tetapi Quarter Pounder with Cheese kini kekal kembali!#McDMalaysia… https://t.co/BvxjdkrScI",922,573,9,[{'url': 'https://t.co/BvxjdkrScI'}]
165,1311878638925565959,2020-10-02 04:00:15+00:00,Siapa cepat dia dapat! Screenshot je semua mainan Minions yang berwarna emas dan RT tweet ni.Jawapan tepat terpan… https://t.co/ZvjdyCgm8E,138,93,9,[{'url': 'https://t.co/ZvjdyCgm8E'}]
166,1236863619981144066,2020-03-09 03:57:21+00:00,Me: Scroll YouTube cari video untuk ditonton sambil makan Big MacMy Big Mac: https://t.co/ljTSHIbppK,46,9,2,[]
167,1329257647380471814,2020-11-19 02:58:14+00:00,Thank you for bringing this to our attention and we truly appreciate the compliments shared. We will be rewarding t… https://t.co/xuGKEqtBzB,270,27,7,[{'url': 'https://t.co/xuGKEqtBzB'}]
168,1305781176737513472,2020-09-15 08:11:07+00:00,Komain lagi...Tak sabar eden nak poyie montadaghah Burger paneh sampai hongeh.ejaan ni betul tak orang negeri? https://t.co/QU6e11nsrU,1628,764,9,[{'url': 'https://t.co/QU6e11nsrU'}]
169,1121051452015669248,2019-04-24 14:01:08+00:00,"Dari jauh nampak cantik,Bila dekat nampak baik,Bau mu buat selera ku naik,D24 Durian McFlurry memang terbaik",326,94,10,[]
170,1318476541844623361,2020-10-20 08:57:58+00:00,Tahniah!! Anda pemenang baucar McDonald’s bernilai RM50! Sila DM kami maklumat anda untuk dihubungi selanjutnya. https://t.co/Vv44rvjmA4,16,1,0,[{'url': 'https://t.co/Vv44rvjmA4'}]
171,1128628337650233345,2019-05-15 11:48:59+00:00,"Pekerja: Selamat datang ke McDonald’s, makan sini ke?Pelanggan: Tak, makan kat sana *Sambil menunjukkan meja mak… https://t.co/sUuB0uy3hD",620,338,10,[{'url': 'https://t.co/sUuB0uy3hD'}]
172,1275455090191548416,2020-06-23 15:46:04+00:00,"Cabaran TikTok #RasaMcCafe kami masih berlangsung.Mana la tahu… duduk rumah pun boleh menang RM10,000https://t.co/pkTAQU5cJh",22,4,3,[{'url': 'https://t.co/pkTAQU5cJh'}]
173,1277557212831838211,2020-06-29 10:59:10+00:00,______________________________________________|… https://t.co/5JIJUehuFd,235,41,9,[{'url': 'https://t.co/5JIJUehuFd'}]
174,1362016445182316548,2021-02-17 12:30:00+00:00,Me: Rasanya air Mekdi semalam tak minum habis pun…Semalam: https://t.co/GTUDU0N2yU,282,70,3,[]
175,1207532509241544705,2019-12-19 05:25:59+00:00,"Hari ni nak tweet buka topik sikit. Sebagai orang yang dah lepas fasa SPM, cuba share pengajaran or pengalaman untu… https://t.co/HPxRWPiANQ",316,31,9,[{'url': 'https://t.co/HPxRWPiANQ'}]
176,1382962709969260545,2021-04-16 07:42:58+00:00,Pukul berapa paling awal korang beli juadah berbuka? https://t.co/1WfL6rXKkh,212,57,11,[]
177,1318805586260062209,2020-10-21 06:45:28+00:00,Tahniah!! Anda pemenang baucar McDonald’s bernilai RM50! Sila DM kami maklumat anda untuk dihubungi selanjutnya. https://t.co/R4fIeEHSzY,20,2,5,[{'url': 'https://t.co/R4fIeEHSzY'}]
178,1380135839863242764,2021-04-08 12:30:00+00:00,Beef Foldover kini kembali. Nikmati keenakan daging digril sempurna dengan sos pedas unik pastinya membangkit sele… https://t.co/wgFldaxKzf,42,16,4,[{'url': 'https://t.co/wgFldaxKzf'}]
179,1351831837757349888,2021-01-20 10:00:00+00:00,"Masih ingatkah dikau, dulu kami menjual M&amp;M’s McFlurry...",1326,221,10,[]
180,1348933992158879747,2021-01-12 10:05:00+00:00,Azam 2021 saya adalah makan GCB dengan 2 suapan. https://t.co/oXhS8Vy3QB,306,33,10,[]
181,1382251577545682947,2021-04-14 08:37:11+00:00,Alaaaa… betul ke Ramadan ni Beef Foldover ada balik? https://t.co/CkBYkMjK1b,307,58,10,[]
182,1362732413038645250,2021-02-19 11:55:00+00:00,"Makcik A: Si Abu tu bagus orangnya, dengar orang lapar dia sanggup redah hujan pergi hantarkan makanan.Makcik B:… https://t.co/7vcMvnMSZr",113,21,2,[{'url': 'https://t.co/7vcMvnMSZr'}]
183,1357652692999438337,2021-02-05 11:30:00+00:00,Drive-Thru dari 8pg – 10mlmMcDelivery dari 8pg - 9.30mlmWaktu timeline anda sendu 12pg - 3pg..,672,322,9,[]
184,1332188977688834048,2020-11-27 05:06:17+00:00,Kisah ini membuktikan masih ramai anak muda Malaysia yang beretika &amp; fokus dlm mencari rezeki. Geng di Twitter juga… https://t.co/8K77KQln8K,34,2,4,[{'url': 'https://t.co/8K77KQln8K'}]
185,1377906054109929478,2021-04-02 08:49:38+00:00,Manis mulut ni pantang dekat. Pemanis mulut Salted Caramel ni pulak pantang dapat...,68,10,1,[]
186,1192298245373874177,2019-11-07 04:30:28+00:00,"Anda nak fancy kami ada GCB,Anda nak rangup kami ada McChicken,Anda nak pedas kami ada Spicy Chicken McDeluxe,A… https://t.co/SN7gJyfUZ1",703,161,10,[{'url': 'https://t.co/SN7gJyfUZ1'}]
187,1095920805819572225,2019-02-14 05:40:55+00:00,Saya baru belajar lagi Twitter ni. Dekat mana ye button tweet?,99,27,8,[]
188,1350023672002736131,2021-01-15 10:15:00+00:00,1 Coffee + 1 Cake dengan harga RM12.99. Hanya di McCafe.ON x ON ? https://t.co/oJH9cwQ4iD,90,21,0,[]
189,1096637759853195265,2019-02-16 05:09:51+00:00,"Hi warga Twitter, sila retweet tweet ini jika tidak tiada siapa yang akan retweet tweet ini",601,1165,9,[]
190,1296711164127137794,2020-08-21 07:30:07+00:00,"Tik tok tik tok! Masa makin suntuk ni. Kalau nak McD favorite korang jadi Mekdi, kena lah undi kan. Harini je tau.… https://t.co/Zq2iWenZpk",39,10,1,[{'url': 'https://t.co/Zq2iWenZpk'}]
191,1321602667970400256,2020-10-29 00:00:04+00:00,Salam Maulidur Rasul kami ucapkan kepada seluruh umat Islam di Malaysia. https://t.co/xUb85WEW4C,180,27,1,[]
192,1327159266910887941,2020-11-13 08:00:01+00:00,"A touch of light. A glimmer of hope. Even in darkness, the lights of our lives will shine through. Happy Deepaval… https://t.co/LQXb8rZt05",46,8,0,[{'url': 'https://t.co/LQXb8rZt05'}]
193,1288301186890702848,2020-07-29 02:31:53+00:00,Apa? Ada CRAAAAAZY offer McCafe kat dalam aplikasi McDonald’s?,153,8,10,[]
194,1358053079925592064,2021-02-06 14:01:00+00:00,"Minuman baharu, lagi banyak pilihan! Padankan minuman Mocha Ais atau Coklat Ais dengan kek kegemaran anda pada hany… https://t.co/Dqki9zqz28",38,10,2,[{'url': 'https://t.co/Dqki9zqz28'}]
195,1113631659226583040,2019-04-04 02:37:32+00:00,Kadang-kadang orang makan di McD ada 2 sebab1. Sebab ada wifi2. Sebab lapar lah apa lagi,1852,1506,10,[]
196,1293134578358448128,2020-08-11 10:38:03+00:00,"Memperkenalkan kombinasi baharu Nasi Lemak McD dengan kepingan ayam GCB. Perut kenyang hati pun senang, pesan guna… https://t.co/x4mJp4L9IQ",131,40,5,[{'url': 'https://t.co/x4mJp4L9IQ'}]
197,1118304380871041025,2019-04-17 00:05:16+00:00,"Kita adalah orang yang simple, kita nampak harga separuh, kita beli.https://t.co/fQxVFf6YpB https://t.co/KWz4BTVbjn",143,64,9,[{'url': 'https://t.co/fQxVFf6YpB'}]
198,1159374144565202944,2019-08-08 08:01:50+00:00,"Your jodoh is like McFlurry Cempedak, kalau lambat........terlepas. #McFlurry https://t.co/COgPQveB13",352,85,10,[]
199,1373126848767397890,2021-03-20 04:18:46+00:00,"RT @nonie_razni: @McDMalaysia 🎶 bubur ayammm,bubur ayam mekdi,panas &amp; enak bubur ayam...bubur ayam mekdiii 🎶",0,4,1,[]
200,1317357272490635266,2020-10-17 06:50:23+00:00,1. Korang dah join thread #McDEkstraPuas ke belum? Ala… Post je gambar korang paling kreatif dengan burger daging b… https://t.co/vpsxwCm4sZ,18,5,2,[{'url': 'https://t.co/vpsxwCm4sZ'}]
201,1121410899607056384,2019-04-25 13:49:27+00:00,Bayangkan anda tidur di atas tilam yang empuk dan disarungkan pula dengan selimut. Indah bukan?Begitu juga Chicke… https://t.co/prtKsb3B7D,271,116,9,[{'url': 'https://t.co/prtKsb3B7D'}]
202,1144101132794380288,2019-06-27 04:32:21+00:00,Matahari : Rasailah sinaran haba ku!Kamu:╭ ◜ ◝ ͡ ◝ ͡◜ ◝   ╮ (  Dinosaur   )(    McFlurry   )(    kembali?… https://t.co/jnY6hyA2xT,649,212,9,[{'url': 'https://t.co/jnY6hyA2xT'}]
203,1326831780217827328,2020-11-12 10:18:42+00:00,Soalan KBKK.Kalau korang diberi peluang cipta McFlurry McD korang sendiri?Korang akan campurkan aiskrim tu dengan apa?Nama apa?,1426,174,9,[]
204,1298025232058290176,2020-08-24 22:31:46+00:00,Gulp... emmm...em https://t.co/6JM41yFqDb,151,16,6,[{'url': 'https://t.co/6JM41yFqDb'}]
205,1354681865710526472,2021-01-28 06:45:00+00:00,Cuba teka mainan istimewa minggu ini.. Rarity dari Ponyville dan Optimus Prime wira lagenda dari Autobots! Dapatkan… https://t.co/TWb4GOmE2m,30,7,2,[{'url': 'https://t.co/TWb4GOmE2m'}]
206,1097773743043076096,2019-02-19 08:23:50+00:00,"Memang best dengan McDelivery CRAZY HOUR dari 3pm hingga 6pm! Diskaun sampai 60%, boleh jimat gila gila GILAAAAAA! https://t.co/YmX7v732yJ",40,28,7,[]
207,1326904570640019468,2020-11-12 15:07:56+00:00,RT @Azfarheri: McFlurry caramel bisscoff https://t.co/NQQyTXT72x,0,4937,2,[{'url': 'https://t.co/NQQyTXT72x'}]
208,1252491003010977792,2020-04-21 06:54:59+00:00,McUACA:      Chocolate Banana McFlurry: https://t.co/5DmzwJoauV,517,146,10,[]
209,1339511025670922240,2020-12-17 10:01:30+00:00,Mekdi Fries enak dicicah ke dalam:,58,7,9,[]
210,1270014600080023553,2020-06-08 15:27:31+00:00,"Ya kombo anda sangat hebat di dalam Mobile Legend, ...tapi tahukah anda kombo Mcdelivery kami menawarkan penjimatan sehingga 45%?",140,18,6,[]
211,1316967282908798976,2020-10-16 05:00:42+00:00,"Cewah, this one dh jadi lookbook! Love it! https://t.co/ImrR7U2ttJ",123,18,4,[{'url': 'https://t.co/ImrR7U2ttJ'}]
212,1208997389823963137,2019-12-23 06:26:54+00:00,"Setiap hari mengidam makan McD? Join jelah jadi team McD.Buat lepasan SPM semua, cuba tengok Program Vokasional M… https://t.co/8dfZIuNyzR",160,39,4,[{'url': 'https://t.co/8dfZIuNyzR'}]
213,1342266306356269059,2020-12-25 00:30:00+00:00,Merry Christmas from all of us at McDonald’s Malaysia! Wishing you and your loved ones a safe and joyful celebratio… https://t.co/OnsxRyqByf,50,7,0,[{'url': 'https://t.co/OnsxRyqByf'}]
214,1318518464483532800,2020-10-20 11:44:33+00:00,Tahniah!! Anda pemenang baucar McDonald’s bernilai RM50! Sila DM kami maklumat anda untuk dihubungi selanjutnya. https://t.co/8nYXGcg92F,29,2,2,[{'url': 'https://t.co/8nYXGcg92F'}]
215,1248166115525591041,2020-04-09 08:29:26+00:00,Setakat ni kami tak pasti ada franchise ke tak di Nebula M78.Mungkin boleh minta Taro tapaukan kalau dia singgah d… https://t.co/BvrBVEXsta,328,133,11,[{'url': 'https://t.co/BvrBVEXsta'}]
216,1300696929249107969,2020-09-01 07:28:08+00:00,Ikuti siri penjelejahan Doraemon yang menakjubkan! Dapatkan mainan Magnetic Doodle! Doraemon Drawing Board ataupun… https://t.co/1M8xPPFawP,34,11,4,[{'url': 'https://t.co/1M8xPPFawP'}]
217,1115514788858060800,2019-04-09 07:20:25+00:00,Soalan:Macam mana nak bagi girlfriend kita happy?Jawapan:Bawak pergi Mcd. Sebab dekat McD ada Happy meal,1573,981,8,[]
218,1192443667845279744,2019-11-07 14:08:19+00:00,RT @qatarkhadi: Korang yang suka lepak McD tu haaa tgk ni @McDMalaysia https://t.co/UyUIhjKktH,0,9207,1,[]
219,1352069653166755842,2021-01-21 01:45:00+00:00,Beri laluan untuk anak kuda dan robot mainan! Dapatkan Happy Meal dengan mainan My Little Pony atau Transformers PE… https://t.co/2Zka9Az7ij,31,13,2,[{'url': 'https://t.co/2Zka9Az7ij'}]
220,1235741726389592064,2020-03-06 01:39:21+00:00,"Di McCafe Wakaf Che Yeh, Kelantan. Mereka tidak minum latte.Mereka minum Comel Latte.",7868,4691,10,[]
221,1285735305564368896,2020-07-22 00:35:59+00:00,Senyum lebar nampak. Mana taknya. Dapat half price je kan. Nak bagitau ni. Anda boleh dapat minuman di McCafe denga… https://t.co/WnAs0QdYv4,137,39,2,[{'url': 'https://t.co/WnAs0QdYv4'}]
222,1357524347624169472,2021-02-05 03:00:00+00:00,Keenakan rasa kepingan epal manis dan ayam pedas. Manis atau pedas? Cuba dulu. Pesan Burger Ayam Pedas dan Epal BAH… https://t.co/fadlmMWalv,47,17,2,[{'url': 'https://t.co/fadlmMWalv'}]
223,1356935469162881024,2021-02-03 12:00:01+00:00,"Epal...pedas? Nak tahu, tunggu esok.  🍎+🌶️ https://t.co/odZbzHgIOz",29,6,0,[]
224,1151428125445672961,2019-07-17 09:47:12+00:00,Bila orang depan kau fikir terlalu lama nak order apa… https://t.co/w0p4zqNbu9,176,72,2,[]
225,1261136001079992321,2020-05-15 03:27:08+00:00,Burger Samurai kini kembali! Nikmati citarasa legenda Jepun dengan pilihan kepingan daging digril empuk atau pati a… https://t.co/RYIyWaqMQt,130,58,9,[{'url': 'https://t.co/RYIyWaqMQt'}]
226,1311487275939717120,2020-10-01 02:05:07+00:00,Minions kembali lagi ke McD! Jom kumpulkan 35 mainan dari 1 Okt-18 Nov! PERCUMA dengan Happy Meal.Tertakluk Terma… https://t.co/2cEMMRia4G,148,72,6,[{'url': 'https://t.co/2cEMMRia4G'}]
227,1378148636756901890,2021-04-03 00:53:34+00:00,Nasi Lemak McD kami makin berlemak-lemak pulak dengan aroma pandan ni. Saje je cakap… tak ada niat apa-apa punnn.,146,13,6,[]
228,1325264276248997888,2020-11-08 02:30:00+00:00,Need. Ayam. Goreng. McD. NOW. Satisfy your cravings and get crunching via McDelivery or Drive-Thru. #AyamGorengMcD https://t.co/z9sfZMi94A,47,9,1,[]
229,1252146700384256006,2020-04-20 08:06:51+00:00,Sekarang kami dah letakkan suhu badan krew dan rider kami untuk setiap pesanan McDelivery yang anda buat. Jangan ri… https://t.co/p8fJIocLS6,196,63,7,[{'url': 'https://t.co/p8fJIocLS6'}]
230,1198084862088843264,2019-11-23 03:44:25+00:00,Dua dua besar kepala.. https://t.co/7LwUeTGXkj,1085,514,10,[]
231,1274027357381160960,2020-06-19 17:12:46+00:00,"Ehem, boss... https://t.co/68G1Ttj8Ez",944,308,8,[{'url': 'https://t.co/68G1Ttj8Ez'}]
232,1360921739354497025,2021-02-14 12:00:02+00:00,Cuaca panas?Nak layan movie?Craving yang sweet-sweet?Ini jawapannya. https://t.co/EivbJ8zcCO,109,15,1,[]
233,1261550992325095424,2020-05-16 06:56:09+00:00,Tahniah kepada 25 guru hebat Anugerah Guru Inspirasi McDonald’s 2020! Komitmen dan dedikasi luar biasa anda amat me… https://t.co/BTz6tSTjyc,78,16,5,[{'url': 'https://t.co/BTz6tSTjyc'}]
234,1272371353694294017,2020-06-15 03:32:24+00:00,"Sawadee~kap,Masuk pintu keluar tingkap,Burger Thai mai kari hijau lengkap,McDelivery sampai terus ngap-ngap. https://t.co/gnmokVNP2W",1067,440,10,[]
235,1345188059634159617,2021-01-02 02:00:00+00:00,Burger Prosperity lebih sedap dinikmati bersama yang tersayang. Pesan sekarang melalui McDelivery atau Pandu-Lalu. https://t.co/8VGb2DkxbR,21,1,1,[]
236,1359736422232698881,2021-02-11 05:30:00+00:00,"Ada sebab kami tak keluarkan produk sate.Kami runsing pekerja kami panas, yang dikipas sate.",679,173,10,[]
237,1269905102174687233,2020-06-08 08:12:24+00:00,"Bila orang selalu nampak kau macam 99% selalu fikir deep, padahal kau tengah fikir nak order apa kalau pergi Drive-… https://t.co/nMdCvOrXaf",103,37,1,[{'url': 'https://t.co/nMdCvOrXaf'}]
238,1207210965617430529,2019-12-18 08:08:17+00:00,"Selalu reply nak diskaun kan?Diskaun RM 12 bila order 2 meals, janji guna McDelivery 😉",309,56,10,[]
239,1222829974966587393,2020-01-30 10:32:39+00:00,Kami okay.Kami paham study sambil makan itu adalah nikmat dan less stress. https://t.co/xPpSr6sONp,22857,11390,11,[{'url': 'https://t.co/xPpSr6sONp'}]
240,1373484512773079045,2021-03-21 04:00:00+00:00,"An explosion of sweet and salty, every spoonful of Salted Caramel McFlurry™ is just irresistible! Pair it with Cara… https://t.co/DiTBbZE7vi",58,26,0,[{'url': 'https://t.co/DiTBbZE7vi'}]
241,1275791217691725826,2020-06-24 14:01:44+00:00,"WOW! 200,000 Followers! Terima kasih semua yang menerima Mekdi ke dalam dunia twitter.  Andalah living meme sebena… https://t.co/ojI78X48lx",310,35,9,[{'url': 'https://t.co/ojI78X48lx'}]
242,1200383657585676288,2019-11-29 11:59:00+00:00,SMOKYGRILLEDBEEFSMOOKYGRILLEDBEEFSMOOOKYGRILLEDBEEFSMOOOOOKYGRILLEDBEEFSMOOOOOOOKYGRILLEDBEEFSMOOOOOOOOOKYGRILLEDBEEF,474,72,9,[]
243,1367665820722024454,2021-03-05 02:38:36+00:00,"Penuhi selera bila-bila, waktu operasi restoran kami kini dilanjutkan! Makan di restoran/Pandu Lalu/Bawa Balik dari… https://t.co/Do59CrHHVC",56,32,9,[{'url': 'https://t.co/Do59CrHHVC'}]
244,1292765903554191361,2020-08-10 10:13:04+00:00,Nasi Lemak McD dengan aroma yang membangkitkan selera. Kini boleh dinikmati dengan Rendang Ayam baharu dan kepingan… https://t.co/COtCXgY6YI,85,22,8,[{'url': 'https://t.co/COtCXgY6YI'}]
245,1336641747107999744,2020-12-09 12:00:00+00:00,"Dia datang setahun sekali. Walau apa yang terjadi, dia pasti kembali… https://t.co/Q1pFj5jnVO",514,165,10,[]
246,1102777929669308416,2019-03-05 03:48:41+00:00,Siapa je yang tak pernah try McChicken ni? Klasik kot! https://t.co/2Loz4uNTSK,94,35,7,[]
247,1281062794297663488,2020-07-09 03:09:05+00:00,Rilakkuma kembali lagi! Jangan lepaskan peluang untuk lengkapkan koleksi ini dengan setiap pembelian Happy Meal mul… https://t.co/3Shl6TsvVN,33,7,4,[{'url': 'https://t.co/3Shl6TsvVN'}]
248,1318722950745497600,2020-10-21 01:17:06+00:00,Tahniah!! Anda pemenang baucar McDonald’s bernilai RM50! Sila DM kami maklumat anda untuk dihubungi selanjutnya. https://t.co/mUyTDsBy2Q,37,3,1,[{'url': 'https://t.co/mUyTDsBy2Q'}]
249,1341593491999113217,2020-12-23 03:56:28+00:00,Soalan Baucar RM100 untuk minggu ini telah muncul di bawah. Kami memerlukan warga Twitter dengan jawapan paling tep… https://t.co/0D7rokW0Ze,58,12,10,[{'url': 'https://t.co/0D7rokW0Ze'}]
250,1373304897811017729,2021-03-20 16:06:17+00:00,"Baru dapat info, betul ke kalau makan ayam mekdi jangan terus minum air coke tu. Takut ayam dalam perut tu bercoke-coke?",525,155,9,[]
251,1347724777457242114,2021-01-09 02:00:01+00:00,"Siapa kat sini yang letak Hashbrowns kat dalam burger dia? Haa, tak yah susah-susah. Kita satukan Hashbrowns rangup… https://t.co/s9KC7DPYLG",35,12,2,[{'url': 'https://t.co/s9KC7DPYLG'}]
252,1163755259262431233,2019-08-20 10:10:49+00:00,Budaya rakyat Malaysia adalah breakfast dengan nasi lemak.Budaya rakan yang rupawan adalah yang belanja rakannya… https://t.co/4kdsyD23T6,336,75,9,[{'url': 'https://t.co/4kdsyD23T6'}]
253,1379377088814329856,2021-04-06 10:15:00+00:00,"Korang mesti ada cikgu luar biasa yang selalu bagi  💯 dalam apa pun, kan? Calonkan dorang untuk Anugerah Guru Inspi… https://t.co/X0zNNGCMuc",15,5,1,[{'url': 'https://t.co/X0zNNGCMuc'}]
254,1303543681601867778,2020-09-09 04:00:07+00:00,Rasai momen hangat yang pasti menawan selera anda. Nantikan 10 Sept ini. https://t.co/QV480ZbOpl,85,28,10,[]
255,1351756339199008768,2021-01-20 05:00:00+00:00,"Bukan selalu dapat rasa Twister Fries, betul tak? Apa kata kita tukar French Fries kepada Twister Fries bila order… https://t.co/6bNdKHaf01",42,9,2,[{'url': 'https://t.co/6bNdKHaf01'}]
256,1206782186889728000,2019-12-17 03:44:28+00:00,Akhirnya dia kembali juga. Siapa agaknya yang tolong dia amik attendance? #AkademiMekdi https://t.co/hpZEvZQ5R7,1442,601,10,[]
257,1293010613388492801,2020-08-11 02:25:27+00:00,Kepingan ayam pedas Spicy Chicken McDeluxe dengan Nasi Lemak McD. Pesan je melalui McDelivery ataupun Pandu-lalu. https://t.co/zrrTKNUZp2,65,24,0,[]
258,1265829223962308609,2020-05-28 02:16:19+00:00,Memperkenalkan Burger Shogun BAHARU dari McD! Kini dengan keenakan telur goreng yang mampu membuatkan anda terliur.… https://t.co/METLxYYFK4,128,38,10,[{'url': 'https://t.co/METLxYYFK4'}]
259,1278872822819860480,2020-07-03 02:06:55+00:00,Choo-choo! Thomas &amp; Friends dan Rilakkuma kini kembali! Jom bawa mereka pulang dengan PERCUMA dalam setiap pembelia… https://t.co/EZYNjAsBTP,45,7,2,[{'url': 'https://t.co/EZYNjAsBTP'}]
