,id,date,text,likes,retweet,comments,urls
260,1120211983343636480,2019-04-22 06:25:24+00:00,"Nasi McD kini kembali!Foldover Ayam menambah seri! Teh Ais Limau, dahaga no more worries.",244,80,9,[]
261,1329296633067016192,2020-11-19 05:33:09+00:00,"Dengar cerita Grand McChicken dah keluar. Nak jadikan cerita lagi panas, ada Spicy Grand McChicken sekali. Perghh p… https://t.co/XxASgc1PQe",72,17,7,[{'url': 'https://t.co/XxASgc1PQe'}]
262,1285059888226332672,2020-07-20 03:52:07+00:00,Ottoke….dilemanya nak buat keputusan. Omma atau Soo? Mana satu pilihan Oppa? Saksikan sekarang. https://t.co/FQb4xxFLve,86,17,3,[]
263,1181928511784644609,2019-10-09 13:44:51+00:00,Sapa yang belah lepas after credit filem Joker mesti terlepas scene ni...  ..Budak ni boleh lukis jugak ye? Nak… https://t.co/1cOxhichhM,422,175,7,[{'url': 'https://t.co/1cOxhichhM'}]
264,1324295923346808832,2020-11-05 10:22:07+00:00,"🎙Seberapa pantaskah kau untuk ku tunggu, cukup hebatkah kau untuk screenshot Minions ini? 🎙Cepat screenshot semua… https://t.co/vL9xeCFPP1",99,38,10,[{'url': 'https://t.co/vL9xeCFPP1'}]
265,1106154380934311937,2019-03-14 11:25:30+00:00,"Tahniah pada adik-adik yang sudah mengambil keputusan SPM hari ini.Perjalanan masih jauh, dia dekat...Tapi jauh..",1966,774,10,[]
266,1273103637632466945,2020-06-17 04:02:14+00:00,Life Hack: Cara untuk mudah tidur adalah dengan membayangkan anda dalam kelas.,1402,578,10,[]
267,1103866285488631809,2019-03-08 03:53:25+00:00,"Sila share meme yang korang simpan dalam phone, ayuh jadikan tweet ini Meme checkpoint. Mekdi nak kumpul.",177,45,10,[]
268,1182243551268073473,2019-10-10 10:36:42+00:00,Dia dah lari rumah semula.Ramai sangat cari... https://t.co/8JlvXopp0y,554,213,12,[{'url': 'https://t.co/8JlvXopp0y'}]
269,1374571677686894592,2021-03-24 04:00:00+00:00,Waktu kerja bebas. Elaun setiap minggu. Setiap hantaran boleh dapat sehingga RM10. Jom daftar! https://t.co/uK3XWy7Y2q,34,1,0,[]
270,1116971791291834368,2019-04-13 07:50:02+00:00,"Pada yang selalu mention nak berjimat tu. Tahukah anda kini 1+1 Mix and Match kembali RM5.99 je.""Yesh I got lotsaaaaa mix"" - King MekDiDi",275,72,10,[]
271,1207847683806781442,2019-12-20 02:18:23+00:00,"Tak perlu lagi ke France kalau nak merasai kelazatan Macarons.Satu gigitan anda terus ""Bonjour bonjour bonjour"" https://t.co/FJPoE0PflL",10290,3699,9,[]
272,1332188970747195392,2020-11-27 05:06:16+00:00,RAJIN DAN JUJUR DALAM MENCARI REZEKI.Itu yang terlintas di fikiran bila kami membaca kisah tentang Abang rider Mc… https://t.co/cxP5AJnX6x,282,82,4,[{'url': 'https://t.co/cxP5AJnX6x'}]
273,1133719055938904065,2019-05-29 12:57:41+00:00,"Pada yang sedang planning ataupun sudah bergerak pulang ke kampung masing-masing,1. Pandu dengan selamat2. Desti… https://t.co/UR3pP2oRqc",453,153,10,[{'url': 'https://t.co/UR3pP2oRqc'}]
274,1140114190478139392,2019-06-16 04:29:39+00:00,Lain macam ya saudara kita di sana...Challege guys https://t.co/25vhTV6UHw,710,425,11,[{'url': 'https://t.co/25vhTV6UHw'}]
275,1328234725098487809,2020-11-16 07:13:30+00:00,Sedang di per-timbang-kan. https://t.co/EN14TNl52f https://t.co/d09sxDBeSs,88,8,11,[{'url': 'https://t.co/EN14TNl52f'}]
276,1156062909157347328,2019-07-30 04:44:10+00:00,Waktu terbaik untuk bersemangat kemas bilik adalah ketika anda perlu siapkan homework/assignment.RT sebagai tanda… https://t.co/Ifu7bgFlXk,379,207,10,[{'url': 'https://t.co/Ifu7bgFlXk'}]
277,1275734705539694593,2020-06-24 10:17:10+00:00,"Pie kali ini agak ‘rare’, untuk kita-kita...Pulut dan Santan bergabung tenaga!Ada yang dah cuba? https://t.co/BEYRTZfdos",107,34,5,[]
278,1149206782591373313,2019-07-11 06:40:22+00:00,Agak-agaknya Cristiano Ronaldo dengan Luiz Figo dah rasa belum ya.. #PortugueseChickenBurger https://t.co/X4ol3UutrC,203,60,10,[]
279,1141008300038709249,2019-06-18 15:42:32+00:00,Me thinking about the crispy Chocolate Pie in McD https://t.co/i9UJeOUryf,863,326,9,[]
280,1323466283095101440,2020-11-03 03:25:25+00:00,"Empat dara duduk di tepi sungai. Duduk menjerat si anak lah ayam, eh eh silap masuk… Sis baru duduk nak makan Ayam… https://t.co/6FlSDeQOYB",67,6,9,[{'url': 'https://t.co/6FlSDeQOYB'}]
281,1357217210817683456,2021-02-04 06:39:33+00:00,Beli mana-mana set sebanyak RM25 ke atas dan dapatkan pulangan tunai segera RM5 melalui Boost™ McDonald’s Wallet. G… https://t.co/DOt0aDKd1R,28,7,0,[{'url': 'https://t.co/DOt0aDKd1R'}]
282,1249543909975285761,2020-04-13 03:44:18+00:00,"Pada yang ingin menikmati Burger Daging BBQ terbaru kami. Relaks, pandu lalu atau pesan je melalui McDelivery tan… https://t.co/nrfGw2EKpl",95,6,9,[{'url': 'https://t.co/nrfGw2EKpl'}]
283,1334800297953173505,2020-12-04 10:02:45+00:00,Sejak itu sistem drive-thru diwujudkan di restoran McDonalds yang lain di pelbagai negara. Termasuklah drive-thru p… https://t.co/rEUxJ4N89k,43,5,7,[{'url': 'https://t.co/rEUxJ4N89k'}]
284,1117659618396622848,2019-04-15 05:23:12+00:00,Tiket wayang hari Rabu memang murah tapi tahukah korang di McD ada yang lagi murah? Dengan McCafe Half Price Wednes… https://t.co/KKICWsQ7qV,4527,3237,11,[{'url': 'https://t.co/KKICWsQ7qV'}]
285,1349302672692817920,2021-01-13 10:30:00+00:00,Hmm…entahlahnak. https://t.co/Y08xA76K83,694,159,10,[]
286,1354277957133422592,2021-01-27 04:00:00+00:00,Jangan kata Abang Baki tak payung! Dia tengah “payung” korang wish dalam bahasa Cina tu. Senang gile. Just duet bah… https://t.co/xhBMQlro04,13,3,1,[{'url': 'https://t.co/xhBMQlro04'}]
287,1369498244519198721,2021-03-10 04:00:00+00:00,"Mana -mana pilihan, yang pastinya memang sedap! Nikmati Spicy Beef Burgers baharu dengan rasa sensasi sos tomato pe… https://t.co/ISLDea2wC5",5,2,1,[{'url': 'https://t.co/ISLDea2wC5'}]
288,1334800295012958210,2020-12-04 10:02:44+00:00,Apa yang menariknya adalah drive-thru pertama ini diwujudkan untuk melayani anggota tentera yang tidak dibenarkan k… https://t.co/2aFm8KHZSy,19,1,7,[{'url': 'https://t.co/2aFm8KHZSy'}]
289,1383017325251727362,2021-04-16 11:20:00+00:00,Sebelum dan selepas berbuka puasa be like... https://t.co/jl1Xg3JfT5,92,14,2,[]
290,1349301861270974465,2021-01-13 10:26:47+00:00,"Dear Valued Guests, All McDonald’s Malaysia restaurants in Selangor, Wilayah Persekutuan (KL, Putrajaya and Labua… https://t.co/nKE9oseu1l",14,5,1,[{'url': 'https://t.co/nKE9oseu1l'}]
291,1318889461539774465,2020-10-21 12:18:46+00:00,Tahniah!! Anda pemenang baucar McDonald’s bernilai RM50! Sila DM kami maklumat anda untuk dihubungi selanjutnya. https://t.co/z940plCUkE,35,3,2,[{'url': 'https://t.co/z940plCUkE'}]
292,1156620929054588928,2019-07-31 17:41:33+00:00,Yang belum bertemu jodoh tuJemput sendu bersama-sama di ruangan komen https://t.co/iseMcUtJzG,2483,1975,10,[{'url': 'https://t.co/iseMcUtJzG'}]
293,1281487523596795905,2020-07-10 07:16:49+00:00,"Budak: Abang, umur abang berapa?Aku: Abang dulu nak tukar channel kena bangun pergi tekan butang kat TV dik.",736,164,10,[]
294,1380722210814390276,2021-04-10 03:20:02+00:00,"Gais...Siapa dah cuba letak Sundae dalam Latte? Jom share gambar! Upload kat komen, atau share kat page korang… https://t.co/D5DF2EwI0q",76,17,8,[{'url': 'https://t.co/D5DF2EwI0q'}]
295,1168822678079168512,2019-09-03 09:46:56+00:00,Bila kau bangun awal sebelum alarm handphone https://t.co/Jld82QiJu2,355,222,7,[]
296,1316255012805242882,2020-10-14 05:50:24+00:00,"Pelanggan yang Dihormati,Semua restoran McDonald’s Malaysia di Kuala Lumpur, Putrajaya dan Selangor kini dibuka d… https://t.co/PUNxQisl0N",684,639,7,[{'url': 'https://t.co/PUNxQisl0N'}]
297,1385851000804679680,2021-04-24 07:00:01+00:00,"Seharian menahan lapar, apa kata berbuka dengan kerangupan dan kelazatan Ayam Goreng McD! Pesan hari ini dengan Mc… https://t.co/GaXZ4d6X2y",28,1,0,[{'url': 'https://t.co/GaXZ4d6X2y'}]
298,1098555718196580354,2019-02-21 12:11:08+00:00,Chicken ah?!?Don't be chicken! Watch now! https://t.co/6tF5z08qqg,96,59,1,[]
299,1357886733598220289,2021-02-06 03:00:00+00:00,"Burger Ayam Pedas dan Epal BAHARU. Kepingan epal manis dan ayam pedas. Apa rasanya? Nak tahu, pesan McDelivery atau… https://t.co/GkIoQcj6Gu",20,3,0,[{'url': 'https://t.co/GkIoQcj6Gu'}]
300,1222885475360206849,2020-01-30 14:13:12+00:00,Bila cashier tanya taknak cuba Spicy Chicken McNuggets ke? https://t.co/AS61FsrLlQ,889,269,9,[]
301,1169948952893915136,2019-09-06 12:22:21+00:00,Penemuduga: Resume awak mengatakan awak ada PHD? Aku : Ah...maksud saya 'Pandai Habiskan Duit' Penemuduga:,1325,739,10,[]
302,1161982641534406656,2019-08-15 12:47:04+00:00,Nasi Lemak bukan makanan rasmi Malaysia? Eh biar betul?Jalankan tanggungjawab anda sebagai rakyat Malaysia! Tanda… https://t.co/l2XwkE6SNi,193,60,9,[{'url': 'https://t.co/l2XwkE6SNi'}]
303,1164806684423757830,2019-08-23 07:48:49+00:00,"Sempena 37 tahun kami di negara tercinta ini, kami menghargai anda memberi nama panggilan yang comel kepada kami.… https://t.co/mxg9Ve6oFx",2630,956,7,[{'url': 'https://t.co/mxg9Ve6oFx'}]
304,1300017891631218688,2020-08-30 10:29:53+00:00,6 33 777 3 33 55 2 ! https://t.co/vX1Nn46MY6,870,477,11,[]
305,1314052920363507714,2020-10-08 04:00:04+00:00,"Jeng jeng jeng.. Korang dah sedia? Senang je, screenshot semua Minions emas dan RT tweet ni.Jawapan tepat terpant… https://t.co/xf8y1xmDAk",112,82,10,[{'url': 'https://t.co/xf8y1xmDAk'}]
306,1127574786865917952,2019-05-12 14:02:33+00:00,"Hidangan Foldover Ayam empuk untuk anda ketika berbuka, tetapi pastikan selepas azan maghrib!Tahniah pada anda ke… https://t.co/JWshCl4U8H",199,22,9,[{'url': 'https://t.co/JWshCl4U8H'}]
307,1310910561224290309,2020-09-29 11:53:27+00:00,Cuci PingganBila kat rumah sendiri:“Japgi lah besok”Bila kat rumah orang:“Tak payah la susah-susah”“Eh takpe… https://t.co/VIy1VDdJUM,598,300,10,[{'url': 'https://t.co/VIy1VDdJUM'}]
308,1159739584168652805,2019-08-09 08:13:58+00:00,"Okay satu soalan, makanan apa yang korang rasa wajib dijadikan makanan rasmi Malaysia?",478,42,10,[]
309,1293370853074247686,2020-08-12 02:16:55+00:00,"Sungguh lazat memikat hati, Nasi Lemak McD dipadankan dengan Rendang Ayam BAHARU. Jom pesan sekarang guna McDeliver… https://t.co/Kfyu691wSF",57,16,1,[{'url': 'https://t.co/Kfyu691wSF'}]
310,1379977296057090058,2021-04-08 02:00:00+00:00,"Bulan mulia hampir tiba,Hidangan McD dikongsi bersama,Foldover Daging memikat rasa,Foldover Ayam menawan selera.… https://t.co/YofcV0H3to",66,28,1,[{'url': 'https://t.co/YofcV0H3to'}]
311,1324564996324388865,2020-11-06 04:11:19+00:00,"Macam biasa guys.  Rider-rider McDelivery kami sedia berkhidmat dikala anda kelaparan pada saat ini, okay? https://t.co/xqzdb06Fo2",182,10,10,[]
312,1188010940672831490,2019-10-26 08:34:15+00:00,"RT @farhanmzln: Semalam makan dekat McD, tengok brader hoodie kuning tu, dia kemas meja sendiri lepas habis makan, memang contoh yang baik…",0,6098,1,[]
313,1351834379329302530,2021-01-20 10:10:06+00:00,Entahlahnak... https://t.co/FpX8hR1lfp,347,95,1,[{'url': 'https://t.co/FpX8hR1lfp'}]
314,1169169860217061376,2019-09-04 08:46:31+00:00,Okay boss suruh aku tanya korang.Flavour McShaker apa yang korang paling suka?Atau korang cadangkan flavour yang patut McD buat,1050,360,9,[]
315,1114150377669005312,2019-04-05 12:58:44+00:00,"Perjalanan balik kampung :Isteri: Bang,singgah McD boleh? Lapar laSuami: Awak ni kan! Kita dah lambat tahu tak.K… https://t.co/oW1MbraggW",836,376,9,[{'url': 'https://t.co/oW1MbraggW'}]
316,1319474254266560513,2020-10-23 03:02:31+00:00,"Sepantas kilat! Oleh kerana kelajuan anda, anda berjaya memenangi RM 40. Syabas diucapkan. Nanti DM maklumat anda d… https://t.co/Lt2zHUWMnL",40,4,2,[{'url': 'https://t.co/Lt2zHUWMnL'}]
317,1289022170408968192,2020-07-31 02:16:48+00:00,"Pulang ke kampung bersama keluarga,Jangan pula lupa pada SOP,Selamat Hari Raya Aidiladha,Buat semua pelanggan Mc… https://t.co/KiO37ni09h",45,11,2,[{'url': 'https://t.co/KiO37ni09h'}]
318,1153912965160042496,2019-07-24 06:21:04+00:00,RT @FarraAzizz: AYAM GORENG MCD 3X SPICY IS UP GUYS!!!! ❤️❤️❤️❤️ https://t.co/0UshE279Sf,0,3899,1,[]
319,1311982960267026432,2020-10-02 10:54:47+00:00,Tahniah 🎉🎉Anda telah memenangi baucar McDonalds sebanyak RM30!Sila DM kami maklumat anda dan admin akan menghubungi… https://t.co/hdWsRuDInG,74,7,11,[{'url': 'https://t.co/hdWsRuDInG'}]
320,1203554057350193152,2019-12-08 05:57:02+00:00,Yang mana satu anda lebih rindu?,162,11,9,[]
321,1148460638848446464,2019-07-09 05:15:28+00:00,Rindu https://t.co/JqDD79r1uD,9634,7368,9,[{'url': 'https://t.co/JqDD79r1uD'}]
322,1105314084944109568,2019-03-12 03:46:28+00:00,Saat yang tidak dapat dilupakan pada tahun lepas semasa pengumuman pemenang Anugerah Guru Inspirasi. Detik indah in… https://t.co/xAUCN37CYe,57,19,5,[{'url': 'https://t.co/xAUCN37CYe'}]
323,1369985203855384581,2021-03-11 12:15:00+00:00,"""Putus cinta, tak perlu berduka. McCafe Iced Latte selalu ada tak kira masa. Lebih manis dikongsi bersama!""Layan M… https://t.co/VkAY3FxFZu",33,4,2,[{'url': 'https://t.co/VkAY3FxFZu'}]
324,1372545843018919939,2021-03-18 13:50:04+00:00,Nasi Lemak McD kini dengan resipi diperbaharui. Lengkap dinikmati dengan Ayam Goreng McD atau kepingan ayam. Tak lu… https://t.co/EAJZialGyH,66,19,2,[{'url': 'https://t.co/EAJZialGyH'}]
325,1340960206323216384,2020-12-21 10:00:01+00:00,Dilema muncul apabila anda bersama 4 rakan hanya order set 6pcs McNuggets dan…tinggal McNugget terakhir. https://t.co/KT9Bwft6qu,106,13,3,[]
326,1319209411282227205,2020-10-22 09:30:08+00:00,How it started:                           How it’s going: https://t.co/5D7Cp0o1q4,4855,1530,10,[]
327,1291222467839700997,2020-08-06 04:00:00+00:00,"Ceriakan hari anda dengan Pan Pan dan Ice Bear dari We Bare Bears! Cepat, kumpulkan kedua-dua mainan comel ni denga… https://t.co/sI7Ajl73Xl",63,20,5,[{'url': 'https://t.co/sI7Ajl73Xl'}]
328,1283610295693279232,2020-07-16 03:51:57+00:00,RT @FoodViralMY: McDonald’s new menu 🍔 😍 https://t.co/BxzT1WgXKO,0,1797,1,[]
329,1110079796006928384,2019-03-25 07:23:42+00:00,Retweet ini jika anda pernah celup McD Fries dengan Sundae dan rasa anda sudah layak masuk Masterchef. https://t.co/ddsIpJl8zW,3936,6859,8,[]
330,1329756376525012992,2020-11-20 12:00:00+00:00,Sambil layan Muzik Muzik 35 Separuh Akhir sambil layan Spicy Grand McChicken. Fuhh padu! #SFMM35 #AJL35 https://t.co/pVfdqyZ9Ph,25,3,2,[]
331,1344325102503018499,2020-12-30 16:50:55+00:00,All beef products used by McDonald’s Malaysia are processed by our supplier MacFood Services (M) Sdn Bhd. Our suppl… https://t.co/p6HXN34slg,24,11,1,[{'url': 'https://t.co/p6HXN34slg'}]
332,1382151622688604162,2021-04-14 02:00:00+00:00,Amaran: PEDAS! Untuk anda yang betul-betul tahan pedas sahaja. 🥵 Cuba pilihan baharu Spicy Beef burger hari ini. Pe… https://t.co/vb2ESDPWyN,9,3,0,[{'url': 'https://t.co/vb2ESDPWyN'}]
333,1327160438644117505,2020-11-13 08:04:40+00:00,"Despite these uncertain times, the lights in our lives will always shine on – full of joy, happiness and prosperity… https://t.co/VHPRkaTCvQ",41,7,1,[{'url': 'https://t.co/VHPRkaTCvQ'}]
334,1322029208986595329,2020-10-30 04:15:00+00:00,Barang baek tak payah sembang panjang. #AyamGorengMcD #AyamGorengViral https://t.co/Yr31gxiZJ7,261,99,5,[]
335,1142398516393697280,2019-06-22 11:46:45+00:00,"Ketibaan Fanta McFreeze di McDPenuh bergaya, berjalan tersipu-sipu malu bersama kesejukan ke bibir anda.Jemput o… https://t.co/ExIMt77gkK",405,88,5,[{'url': 'https://t.co/ExIMt77gkK'}]
336,1136826332464107520,2019-06-07 02:44:53+00:00,Sepatutnya siapa yang lebih layak diberi duit raya?,347,139,8,[]
337,1337020077850255363,2020-12-10 13:03:21+00:00,Pemenang minggu ini dengan kelajuan retweet pantas memecut meninggalkan yang lain. DM kami maklumat anda untuk mene… https://t.co/WL9qEhUzeE,56,16,4,[{'url': 'https://t.co/WL9qEhUzeE'}]
338,1357218580920586240,2021-02-04 06:45:00+00:00,Yang dinanti-nantikan kini telah tiba! Dapatkan mainan percuma Rainbow Dash dari My Little Pony dan Megatron dari T… https://t.co/GOX30tAC4Y,30,6,0,[{'url': 'https://t.co/GOX30tAC4Y'}]
339,1322365172829155329,2020-10-31 02:30:00+00:00,"Pedas Ayam Goreng McD ni pedas semacam. Makan sekali nak lagi. Memang bukan macam biasa! Nak rasa pedasnya, pesan M… https://t.co/sSTJKUlDQN",45,8,8,[{'url': 'https://t.co/sSTJKUlDQN'}]
340,1373524416307490817,2021-03-21 06:38:34+00:00,Caramel Cream Cheese Pie tumpang lalu… https://t.co/7LLmPuhbSe,1004,206,10,[]
341,1264396095792181248,2020-05-24 03:21:35+00:00,"Walaupun jauh di mata, dihati tetap tak dilupakan. Begitulah uniknya perayaan kita tahun ini, namun kemeriahan teta… https://t.co/9Oho0NfHvR",54,10,7,[{'url': 'https://t.co/9Oho0NfHvR'}]
342,1159352502455681024,2019-08-08 06:35:50+00:00,Entahlahnak... https://t.co/sLrSemfeS6,16695,22119,11,[{'url': 'https://t.co/sLrSemfeS6'}]
343,1134676817581813765,2019-06-01 04:23:29+00:00,"Dear Army,Jika oppa #BTS anda belum kembali,Oppa Spicy Korean Burger kini kembali. Kini dengan pilihan Ayam dan Daging. Saranghae ♥",6389,2369,10,[]
344,1385533911225323524,2021-04-23 10:00:01+00:00,Bila korang tak tau nak pilih yang mana satu...layan dua-dua je! Senang. Pesan McFlurry Mangga dan Pai Kastard Mang… https://t.co/j7JdlGWovM,21,4,0,[{'url': 'https://t.co/j7JdlGWovM'}]
345,1344274336513892352,2020-12-30 13:29:11+00:00,Pemenang minggu terakhir! Baucer McDonalds RM100 milik anda. Kelajuan jari yang pantas dan minda yang cerdas. DM ka… https://t.co/SxV7jZJwIy,18,1,0,[{'url': 'https://t.co/SxV7jZJwIy'}]
346,1271070816088633344,2020-06-11 13:24:32+00:00,☑️☑️ https://t.co/YP4oY0X6c2,79,4,5,[{'url': 'https://t.co/YP4oY0X6c2'}]
347,1300374545556074496,2020-08-31 10:07:06+00:00,"Ada orang ‘Merdeka’ bila tamat peperiksaan,Ada orang ‘Merdeka’ bila jelaskan pinjaman pengajian.Walau apa pun de… https://t.co/9ZqMzIY9P3",232,69,2,[{'url': 'https://t.co/9ZqMzIY9P3'}]
348,1271070279704309762,2020-06-11 13:22:24+00:00,Huk-aloh-tercyduk-ambo https://t.co/EFBs5k9qsQ,556,166,11,[{'url': 'https://t.co/EFBs5k9qsQ'}]
349,1338302692414746624,2020-12-14 02:00:00+00:00,"TWISTER FRIES kini kembali!!! Ya, Min dengar permintaan korang. U know the drill - McDelivery atau Pandu-lalu sekar… https://t.co/lp8zp2PVZM",88,20,6,[{'url': 'https://t.co/lp8zp2PVZM'}]
350,1366236753762336773,2021-03-01 04:00:00+00:00,Tahniah pemenang minggu ketiga! Kami akan hubungi anda. 1 lagi hadiah Huawei menanti.Cara sertai:1. Pesan McDeli… https://t.co/cLJ61TqY9i,15,0,2,[{'url': 'https://t.co/cLJ61TqY9i'}]
351,1100230292885843968,2019-02-26 03:05:17+00:00,"Baik korang download app McDonald’s sekarang sebab boleh jimat! Dari pukul 12 – 3 petang everyday, korang dapat mak… https://t.co/6dKV1OSDDy",46,20,4,[{'url': 'https://t.co/6dKV1OSDDy'}]
352,1352798209379360768,2021-01-23 02:00:01+00:00,"Dulu di TV, sekarang di sisi! McDonald’s nak berikan korang peluang keemasan untuk merasai sendiri sehari bersama d… https://t.co/950ZijxJXB",17,3,2,[{'url': 'https://t.co/950ZijxJXB'}]
353,1238380888418684929,2020-03-13 08:26:26+00:00,INI BUKAN TWEET MAKANAN.Tweet ini untuk menghargai guru-guru. Calonkan guru anda yang byk luar biasa dan berjasa.… https://t.co/4nzuYX9cck,87,20,6,[{'url': 'https://t.co/4nzuYX9cck'}]
354,1370709979108311040,2021-03-13 12:15:00+00:00,"""Kenikmatan McChicken, ibarat disuap bidadari dari kayangan. Kami takde bidadari, tapi kami ada McDelivery. Pesan s… https://t.co/DOt7vtX18B",21,3,0,[{'url': 'https://t.co/DOt7vtX18B'}]
355,1301339209202950144,2020-09-03 02:00:19+00:00,"Tak soba rasanya. Eh tak sabar rasanya. McCafe Ada Boba! Tiga minuman hebat iaitu Brown Sugar Boba Latte, Brown Sug… https://t.co/jzlbqifx9r",4833,2761,9,[{'url': 'https://t.co/jzlbqifx9r'}]
356,1128912812950994944,2019-05-16 06:39:23+00:00,Semua barang mahal! .... Kami faham Kena berjimat.... Kami fahamPoket tak tebal... Kami faham Murah sikit lah...… https://t.co/YFPPxRhsQ6,3100,1955,10,[{'url': 'https://t.co/YFPPxRhsQ6'}]
357,1375024662376239104,2021-03-25 10:00:00+00:00,Rancang hari istimewa yang tersayang dengan mudah di McD. Kami sentiasa mematuhi SOP dengan teliti untuk keselesaan… https://t.co/p7DromcOVd,14,1,0,[{'url': 'https://t.co/p7DromcOVd'}]
358,1318804974801809408,2020-10-21 06:43:02+00:00,Tahniah!! Anda pemenang baucar McDonald’s bernilai RM50! Sila DM kami maklumat anda untuk dihubungi selanjutnya. https://t.co/5F7VaznSWE,12,0,0,[{'url': 'https://t.co/5F7VaznSWE'}]
359,1228130769136058370,2020-02-14 01:36:07+00:00,"Perhatian,Yang single hari ni... jangan baca. https://t.co/k3WjjLQSLr",1504,734,9,[{'url': 'https://t.co/k3WjjLQSLr'}]
360,1311263345094176770,2020-09-30 11:15:18+00:00,"Pelanggan yang Dihormati,Sila rujuk kepada kenyataan dari McDonald’s Malaysia mengenai kejadian di restoran Pandu… https://t.co/DoFs6kD62q",568,295,10,[{'url': 'https://t.co/DoFs6kD62q'}]
361,1143511870382301189,2019-06-25 13:30:49+00:00,Servis McDelivery:Kami sediakan makanan ✔ Redah cuaca panas ✔ Angkat ‘peace’ pada guard apartment anda ✔Demi… https://t.co/6Q0BfILaJM,308,52,8,[{'url': 'https://t.co/6Q0BfILaJM'}]
362,1147893829778866177,2019-07-07 15:43:10+00:00,Lagi 6 bulan dah tahun 2020.Kami harap korang yang naik kereta terbang tu sekali sekala singgahlah McD Drive-Thru kami kat bawah ni.,2731,2475,10,[]
363,1334335034761723904,2020-12-03 03:13:57+00:00,"Okay, kami kembali! Kami nak bagi korang menang baucar  RM100 dari McDonald's selama 5 minggu!Hanya teka dan jadi… https://t.co/4slY9M2vLi",84,19,10,[{'url': 'https://t.co/4slY9M2vLi'}]
364,1141663444464099328,2019-06-20 11:05:50+00:00,"Biasanya di McD, mana satu yang selalu anda order?",137,40,9,[]
365,1186258838896304128,2019-10-21 12:32:01+00:00,Harus kuat untuk menjadi seorang guru https://t.co/5iT802tCQ6,1319,652,8,[]
366,1267455029255921665,2020-06-01 13:56:41+00:00,Samurai kalau level up jadi apa?Jadi Shogun!,383,55,9,[]
367,1121995653381386240,2019-04-27 04:33:04+00:00,Korang suka barang free?Siapa yang tak suka barang free kan? Say no more!   Bersempena Drive-Thru Weekend yang be… https://t.co/da9nt6JbSL,262,75,10,[{'url': 'https://t.co/da9nt6JbSL'}]
368,1137978033128652802,2019-06-10 07:01:20+00:00,"(When we try to sound Korean, we be like)Anyonghaseyo? Ya Oppaaa~ Chagiya! Dah rasssa Spicy Korean Burger ke bel… https://t.co/7BpO275vGG",489,120,9,[{'url': 'https://t.co/7BpO275vGG'}]
369,1318802635936313344,2020-10-21 06:33:45+00:00,Khas untuk geng twiddur https://t.co/F6tnfufzGO,72,3,3,[{'url': 'https://t.co/F6tnfufzGO'}]
370,1296106895212593153,2020-08-19 15:28:58+00:00,[Free Delivery Extended Till 23 Aug!]Better jio your friends to eat McD because our FREE delivery promo has been e… https://t.co/jvqw9otK4w,33,10,0,[{'url': 'https://t.co/jvqw9otK4w'}]
371,1379999943549542400,2021-04-08 03:30:00+00:00,"Mangga pujangga, memikat rasa. Nikmati pemanis mulut dengan McFlurry Mangga dan Pai Kastard Mangga BAHARU! Cubalah… https://t.co/NgRtGXfsub",244,99,7,[{'url': 'https://t.co/NgRtGXfsub'}]
372,1383582892672970761,2021-04-18 00:47:21+00:00,Me: Bila lupa lagi makan Mango Sundae dalam peti sejuk masa buka semalam... untuk kali kedua! Korang selalu lupa ma… https://t.co/bvSxxRxHb1,25,1,2,[{'url': 'https://t.co/bvSxxRxHb1'}]
373,1318160410248318976,2020-10-19 12:01:46+00:00,Tahniah!! Anda pemenang baucar McDonald’s bernilai RM50! Sila DM kami maklumat anda untuk dihubungi selanjutnya. https://t.co/ah0uAHMHkh,107,1,5,[{'url': 'https://t.co/ah0uAHMHkh'}]
374,1248166212149764098,2020-04-09 08:29:49+00:00,Sampai hati kome... https://t.co/KfupruUG5C,504,163,9,[{'url': 'https://t.co/KfupruUG5C'}]
375,1360544252804149249,2021-02-13 11:00:02+00:00,Tahniah pemenang minggu pertama! Kami akan hubungi anda. 3 lagi hadiah Huawei menanti.Cara sertai:Pesan McDelive… https://t.co/6A8mbI59Dq,17,2,0,[{'url': 'https://t.co/6A8mbI59Dq'}]
376,1365255294264123397,2021-02-26 11:00:02+00:00,"Kami tahu anda rindukan Spicy Chicken McDeluxe. Tak perlu tunggu, pesan terus je melalui Mcdelivery atau Pandu-Lalu! https://t.co/wXJSBqMYgo",4,3,0,[]
377,1373122124379004934,2021-03-20 04:00:00+00:00,5 ramuan hebat Nasi Lemak McD dijamin membangkitkan selera anda. Nikmati dengan Ayam Goreng McD atau Kepingan Ayam… https://t.co/Z6ZDcfFQ0m,19,2,0,[{'url': 'https://t.co/Z6ZDcfFQ0m'}]
378,1377201922029932547,2021-03-31 10:11:40+00:00,RT @yusranazri: Kerusi yang ada Ronald McDonald ni. Takoed. https://t.co/sGJa04DuX6 https://t.co/uqD4TePxIq,0,63,2,[{'url': 'https://t.co/sGJa04DuX6'}]
379,1355818102617993218,2021-01-31 10:00:00+00:00,"Sudah-sudah la scroll tu. Cuba je Golden Prosperity Burger sekarang, tawaran masa terhad je tau. Pesan melalui McDe… https://t.co/xfR1tRFq27",59,9,7,[{'url': 'https://t.co/xfR1tRFq27'}]
380,1380753561999400961,2021-04-10 05:24:36+00:00,Nikmati diskaun 50% bagi Latte Ais untuk sepanjang bulan April! Hanya perlu muat turun aplikasi McDonald’s dan akti… https://t.co/UTh5sAxRlJ,18,2,3,[{'url': 'https://t.co/UTh5sAxRlJ'}]
381,1377818069112868867,2021-04-02 03:00:00+00:00,Apa anda boleh dapat dengan RM10 hari ini?  Anda boleh nikmati hidangan yang lazat dan mengeyangkan ! Pesan Spi… https://t.co/XEVX1iSuKj,9,3,2,[{'url': 'https://t.co/XEVX1iSuKj'}]
382,1363721429762666497,2021-02-22 05:25:00+00:00,Tahniah pemenang minggu kedua! Kami akan hubungi anda. 2 lagi hadiah Huawei menanti.Cara sertai:1. Pesan McDeliv… https://t.co/ZRjDmbCGYi,22,3,1,[{'url': 'https://t.co/ZRjDmbCGYi'}]
383,1331550595027587075,2020-11-25 10:49:35+00:00,GO GRAND! GO GRAND! GO GRAND!GO GRAND! GO GRAND! GO GRAND!GO GRAND! GO GRAND! GO GRAND!GO GRAND! GO GRAND! GO GR… https://t.co/iFBlGSbQRO,87,8,4,[{'url': 'https://t.co/iFBlGSbQRO'}]
384,1104887109851086848,2019-03-10 23:29:49+00:00,"Korang kena try menu baru kami, Breakfast Scrambled Egg Sandwiches dipadankan dengan Hashbrowns dan McCafe Coffee.… https://t.co/Vsmi0XE4ru",171,54,9,[{'url': 'https://t.co/Vsmi0XE4ru'}]
385,1296317139435925506,2020-08-20 05:24:25+00:00,Jeng jeng jeng! Ini lah minggunya untuk anda lengkapkan koleksi We Bare Bears anda. Dapatkannya percuma dengan Happ… https://t.co/z8aNqKrCS0,38,7,1,[{'url': 'https://t.co/z8aNqKrCS0'}]
